;text;option_1;option_2;option_3;option_4;N;Type;Order;Keywords
q35778;Would you allow a pet to sleep on your bed?;Yes.;No.;Maybe.;;35107;O;2, 3, 1;"preference; descriptive"
q35856;Would you date someone who has no intention of contacting either one or both parents ever again?  (Assume that the parents in question are living.);Yes.;Only if there were good reasons for no contact.;No.;;6688;O;;preference
q35862;When you are sleeping, do you prefer:;A cold room;A cool room;A warm room;A hot room;29945;O;;preference
q35869;Could you have a long-term relationship with someone who expressed that they felt unworthy of having you?;Yes;No;;;8228;O;;preference
q35894;Does showering or bathing with your significant other appeal to you?;Yes;No;Only bathing;Only showering;16201;O;2, (3, 4), 1;preference
q35904;In general terms, where should breast-feeding be allowed?;Anywhere.;Only where others are allowed to eat.;Only in discrete / designated areas.;Only in private.;9461;O;;opinion
q35906;Which best describes your method for paying off financial debt?;I pay off debt as soon as possible.;I pay off debt when it is best for me.;I avoid paying if at all possible.;I never borrow money.;13506;O;4, 1, 2, 3;descriptive
q35955;How would you feel if your significant other made more money than you?;Very comfortable;Somewhat comfortable;Somewhat uncomfortable;Very uncomfortable;24997;O;;descriptive
q35959;How much do you like to be tickled during sex?;Tickle me until I cry. It really turns me on.;I like being tickled during sex.;I do not like being tickled during sex.;I don't like to be tickled, ever.;19622;O;;sex/intimacy
q35971;Do you talk to your pets?  (Conversationally, not giving orders.);Yes.;No.;I don't have any pets.;;19886;M;[3];descriptive
q35990;Do you have any totally irrational fears, as in something that is extremely unlikely to happen or imaginary?;Yes;No;;;13097;O;;descriptive
q35995;Have you ever lied to a partner about your sexual history?;Yes;No;I've never discussed my sexual history in this way;;23845;M;[3];descriptive
q35997;When you see a heterosexual couple, what do you think if the female is taller?;They look wrong together.;I actually like it that way.;Interesting, but it really doesn't matter.;Who cares?;8856;O;2, (3, 4), 1;opinion
q36027;How would you feel if one of your parents dated someone close to your age?  Assume for the purpose of this question that their dating would otherwise be acceptable.;I would not care as long as they were happy.;It might be weird, but I'd eventually accept it.;It would be wrong, but I would not get involved.;This would be wrong and I would speak my mind.;1963;O;;preference
q36045;Are you ready to settle down and get married right now?;Absolutely.;No way.;Get married yes, settle down no.;Get married no, settle down yes.;35186;O;2, (3, 4), 1;descriptive
q36058;A friend has become homeless. Would you let them stay with you until they are back on their feet?;Yes;No;I'm Not Sure;;3825;O;2, 3, 1;"descriptive; preference"
q36085;Imagine that, through some misfortune, your significant other loses the ability to have sex again.  Do you stay with them?;Yes.;No.;Only if we're free to have sex with someone else.;;12082;O;2, 3, 1;"sex/intimacy; preference; descriptive"
q36098;Let's say you work for the government. You discover confidential documents proving that the organization you work for is misusing public funds. Which would you do?;Go to the media.;Go to the appropriate law enforcement agency.;Leverage the information to further my career.;Ignore it.;3267;N;;"descriptive; preference"
q36126;Would you be willing to shave your head to raise money for charity?;Yes.;No.;;;2379;O;;"descriptive; preference"
q36208;Would you consider going 'off grid' to live with someone who only had solar power, a wood stove, an outhouse, etc?;Yes.;No.;;;6973;O;;preference
q36235;Would you consider dating someone who is part of a commune?;Yes.;No.;What is a commune?;;2363;M;[3];"descriptive; preference"
q36273;If your doctor discovered that you have a noncommunicable terminal illness that will kill you in about five years, when would you want to be told?;Immediately.;Later, when I have a year or more left.;Later, when I have less than one year left.;Never.;1346;O;;preference
q36327;Would you like to live in a small community where everyone lives and works together, and where all property and possessions are owned collectively?;Yes.;No.;Perhaps, depending upon the specifics.;I already do!;6166;O;2, 3, 1, 4;preference
q36342;Assume that you and your partner have different religious beliefs. If you have a child together, which religion would you force the child follow?;My religion.;My partner's religion.;Both religions, no matter how contradictory.;We would educate our child to make its own choice.;7472;O;(1, 2), (3, 4);religion/superstition
q36345;If an otherwise perfect match gave you an ultimatum to become a vegetarian, what would you do?;Comply - Become a vegetarian.;Rebel - This would be a deal breaker.;Smile - I'm already a vegetarian.;;11743;O;3, 1, 2;preference
q36346;Do you usually add salt to your meals?;Yes;No;;;12373;O;;descriptive
q36355;Would you consider dating someone who has extensive facial tattoos?;Yes.;No.;;;17286;O;;preference
q36357;Motorcycles are...;Good transportation / fun.;Good for others but not for me.;Bad and should be outlawed.;Not interesting.;6946;O;3, 4, 2, 1;opinion
q36411;How often do you (or would you) call in sick to work or school when you are not actually ill?;Never.;Once, twice, or three times per year.;Four to ten times per year.;More than ten times per year.;3959;O;;descriptive
q36465;You have plans to hang out with some friends, but a person you have recently begun dating calls and asks you to do something for the night.  Assuming you are still interested in this person, what do you say?;Yes.  I'll see my friends another time.;No, I'm busy.  How about another time?;Sure, but let's hang out with my friends.;I'll do both somehow, but keep them separated.;11418;N;;preference
q36507;How does owning pets compare to raising children?;Pets and kids are one in the same.;Different species but universal techniques.;They're similar.  Pets can prepare you for kids.;The two are nothing alike.;4303;O;4, (1, 2, 3);opinion
q36519;Do you stop to enjoy simple things in nature?;Often.;Sometimes.;Rarely.;Never.;17801;O;;descriptive
q36524;When riding a bicycle, do you wear a helmet?;Yes, all the time;Yes, some of the time;Rarely or never;I don't ride bicycles;20055;M;[4];descriptive
q36622;Do you prefer to sleep with the lights on or off?;I like it completely dark.;I like a little light.;I like it to be bright.;;5494;O;;preference
q36626;How often do you find yourself holding back your knowledge of a subject because of how it might affect your image?;Very often.;Sometimes.;Rarely.;Never.;8585;O;;descriptive
q36628;You're in bed, spooning behind your partner.  Where would your hand(s) most likely be?;Partner's stomach.;Partner's genitalia.;Partner's chest / breast / heart.;I don't spoon - I only fork.;19232;N;;sex/intimacy
q36631;Is there any genre of music that you completely refuse to listen to?;Yes.;No.;I don't listen to music.;;12984;M;[3];descriptive
q36642;Is supporting 'the troops' the same thing as supporting a war (or conflict)?;Yes.;No.;I'm not sure.;;7154;O;2, 3, 1;"politics; opinion"
q36654;What is your favorite transportation medium?;Land (trains, buses, cars, bikes, feet, etc.);Sea (ships, boats, submarines, etc.);Air (airplanes, rockets, dirigibles, etc.);Other.;11478;N;;preference
q36666;Of these four educational subject areas, which is your favorite?;Language;Mathematics;Science;History;23021;N;;"descriptive; cognitive"
q36671;Would you consider dating or forming an otherwise sexual or romantic relationship with someone who hates your sex/gender?;Yes.;No.;;;5324;O;;preference
q36678;Do you go to the tanner?;Yes;No;For special occaisons;I get my tan naturally;8966;M;2, 3, 1, [4];descriptive
q36679;Do you approve of public nudity?;Yes.;No.;;;5627;O;;"politics; preference"
q36690;Would you rather hang out with someone you don't particularly like, or be alone?;Any company is better than none.;I'd rather be alone.;;;1736;O;;preference
q36695;Which is your preferred method of learning?;Traditional classroom;Computer-based instruction;Self study / reading;Other;11162;N;;"preference; descriptive"
q36790;Let's say you are in line at a grocery store and have many items.  The person behind you just has only one or two.  Do you offer to let them go ahead of you?;Yes.  Always.;Yes, unless I am otherwise in a hurry.;No.  Never.;;27742;O;;descriptive
q36804;If you had to choose one, which type of cheating bothers you the most?;Cheating on a partner.;Cheating on a test.;Cheating on taxes.;Cheating does not bother me.;6721;N;;preference
q36823;Stereo on during sex?;Always.;It depends on the music.;It depends on the sex.;Never.;15435;O;4, (2, 3), 1;sex/intimacy
q36877;Men who wax their chests are...;SEXY!;A little vain in my book.;Kinda creepy.;I don't care.;15416;N;;"preference; opinion"
q36970;Would you be willing to dress up as a member of the opposite sex if it would turn your partner on?;If it excites them, I'd even do it in public.;Yes, but only in private.;No.;I do it already!;12299;O;4, 1, 2, 3;"sex/intimacy; preference"
q36984;Could you date someone who was very funny, but could never take anything seriously?;Yes;No;;;3496;O;;preference
q37044;Would you read a book recommended to you by a significant other?;Yes.;No.;Maybe, depending on the book.;;12914;O;2, 3, 1;"preference; descriptive"
q37070;Which is your preferred communications medium for long-distance relationships?;Voice / video;Chat / email;Other;I don't do long-distance relationships;5828;N;;preference
q37115;Let's say you ask your partner a question and know with certaintly that their answer is a lie, what do you do about it?;Ignore it.;Discreetly probe for more information.;Call them out and see where it goes.;Terminate the relationship, effective immediately.;8966;O;;"preference; descriptive"
q37146;Is there any aspect of your sexuality that you would be too embarrassed to ever share with a match?;Yes;No;;;17012;O;;sex/intimacy
q37151;Before people find out your real age, what do they usually assume?;That I'm younger than I really am.;That I'm older than I really am.;They are usually very close.;I haven't noticed a pattern.;18655;M;2, 3, 1, [4];descriptive
q37154;Suppose one day, your spouse comes home and announces that the two of you will be forever taken care of financially, but only so long as the details remain secret to you, else you will both face financial ruin. How much would this bother you?;A lot, I could not live like that.;A little, but my money and I would get over it.;Not at all.  Show me the money.;;7455;O;;"preference; descriptive"
q37263;Would you consider dating a person who rescues stray animals from the streets and brings them home?;Yes.;No.;;;2893;O;;preference
q37270;If a close friend asks you to come out to a club or bar that does not fit with your own sexual preferences, would you go along?;Yes.;No.;;;3931;O;;"preference; descriptive"
q37271;After a serious relationship, how long should you wait before casually dating?;A few weeks.;A few months.;At least a year.;Why wait?;2280;O;;opinion
q37280;If you were abducted by aliens and were allowed to bring only one form of entertainment, which would it be?;Literature;TV/Movies/Music;Video games;A hydrogen bomb;4756;N;;preference
q37314;Which of the following 'solutions' do you think would provide the biggest reduction in crime rates?;More and better trained police;More and better armed civilians;More and better implemented social programs;More severe punishment for convicted criminals;13000;N;;"politics; opinion"
q37320;How often do you interrupt people?;Never.;Rarely.;Often.;Always.;17417;O;;descriptive
q37353;With respect to climate, I would prefer to live somewhere where:;It is hot and summer-like throughout the year.;There are four distinct seasons.;It is consitently and comfortably average.;There is a long, cold, and snowy winter.;8354;N;;preference
q37371;Imagine that scientists create a new drug.  When swallowed as a pill, it will completely and permanently eliminate feelings of guilt for prior events.  Testing reveals that there are no harmful medical side effects.  How should this pill be distributed?;Over the counter to anyone who wants it.;By doctor's prescription only.;It should not be distributed at all.;;9060;O;;politics
q37389;Would you consider inviting a previous sex partner to your own wedding, if you are only friends now?;Yes.;No.;;;4124;O;;preference
q37425;How familiar are you with the methods OkCupid uses to match people?;Very familiar.;Somewhat familiar.;Not familiar.;;8605;O;;descriptive
q37440;Would you be willing to date someone who your pet clearly dislikes?;Yes.;No.;I do not have a pet.;;3929;M;[3];preference
q37545;Is 'just be yourself' good advice?;Absolutely.;It's vacuous. Who else can I be?;Not quite. I mind how I come off.;No. I misrepresent myself as needed.;9259;O;;"opinion; descriptive"
q37604;Do you believe that, when a soldier kills an enemy soldier in combat during a war, it is murder?;Yes.;No.;;;10696;O;;politics
q37664;Does forbidden fruit taste better?;Yes.;No.;I'm Not Sure.;;1752;O;2, 3, 1;"preference; opinion"
q37676;Are you in favor of age restrictions on drinking alcohol?;Yes, on purchase only.;Yes, on purchase and consumption.;No.;;3410;O;;politics
q37677;Have you ever participated in a high school or college marching band?;Yes.;No.;Both.;;9440;O;3, 1, 2;descriptive
q37681;Have instant ramen noodles ever been your nutritional mainstay for more than 2 weeks?;Yes.;No.;;;13381;O;;descriptive
q37693;Would you be willing to date someone who plays video games almost every day, for at least 2 hours?;Yes, I'd be playing with them.;Yes, but I would not play that much.;Yes, but I don't like video games.;No.;36165;O;;"preference; descriptive"
q37695;Not including Halloween, do you enjoy dressing up in costumes?;Yes - Every chance I get.;Yes - On occasion.;I think that I might, but I do not.;No.;20092;O;;preference
q37708;The idea of gay and lesbian couples having children is:;Acceptable.;Not acceptable.;;;37661;O;;"politics; religion/superstition; opinion"
q37746;Do you enjoy visiting amusement parks?;Yes.;No.;I'm not sure.;;16045;O;2, 3, 1;"descriptive; preference"
q37747;How do you consider yourself to be in terms of logic and emotion?;Mostly logical;Mostly emotional;Equally logical and emotional;Neither logical nor emotional;5070;M;2, 3, 1, [4];"descriptive; cognitive"
q37748;Even if it isn't your personal style, would you dress accordingly to a partner's wishes, just to make them happy during an outing?;Yes, without question.;Yes, within reason.;No.;;6616;O;;preference
q37749;If you are dating someone consistently, but you have not yet decided as a couple to have an exclusive relationship, would you change your OkCupid status to 'Seeing Someone'?;Yes.;No.;I'm not sure.;;2863;O;2, 3, 1;"descriptive; preference"
q37759;If a very skinny stray cat were to come to your doorstep, would you feed it, believing that if you did, it would probably keep coming back?;Yes - I would consider adopting it.;Yes, but I could make no further commitment to it.;No - Someone else should feed it.;No - I would try to scare it away.;7311;O;;"preference; descriptive"
q37764;How often do you read your horoscope?;Daily.;Weekly.;Occasionally.;Never.;20171;O;;"religion/superstition; descriptive"
q37765;How often do you hang out at coffee shops / cafes?;Two or more times a week.;From once a month to once a week.;Less than once a month.;Never.;17413;O;;descriptive
q37772;If you had to choose one for the rest of your life, which would you pick?;Monogamy;An open relationship;Polyamory;Playing the field;12646;O;;preference
q37778;Have you ever written a book?;Yes.;No.;;;8400;O;;descriptive
q37815;Are you more polite to strangers or friends?;Strangers.;Friends.;I'm equally polite to both.;I'm generally rude to both.;4265;M;2, 3, 1, [4];descriptive
q37845;Do you read the dedications and introductions when you're reading a book?;Yes, always or almost always;Occasionally, if I'm interested;No, I just get right to it;I don't read / don't read books with introductions;19831;M;[4];descriptive
q37873;Would you continue to date someone who you felt would always put their pet(s) before you?;Yes.;No.;;;4120;O;;descriptive
q37886;Would you be afraid if you were walking alone on a city sidewalk after dark?;Yes.  I'd be scared for sure.;Yes, if the location is considered dangerous.;No.  No city street scares me.;No, but people should fear me.;2618;O;;descriptive
q37892;Imagine you are having sex with a partner, who begins to give you specific instructions on how to best provide satisfaction.  Assuming there is no danger, would you follow these instructions?;No.  That would be the end of that encounter.;No.  I'd continue doing it my way.;Yes, but I would be offended.;Yes.  I'd be greatful for the communication.;8875;O;;sex/intimacy
q37893;When playing games with friends, which is more important to you?;Winning.;Having fun.;Neither, I do not play games with my friends.;I don't have any friends.;16970;N;;preference
q37936;Do you consider a person's social class when you interact with them?;Yes.;No.;I'm not sure.;;3699;O;2, 3, 1;descriptive
q37986;Have you typically researched the policies of companies before you bought products from them?;Yes.;No.;;;8661;O;;descriptive
q37999;Imagine that you are in an uncommitted relationship with someone you have grown to deeply care about.  They begin to date someone else who seems to make them happier than you do.  Which would you do?;Bow out.;Try harder to win their love.;Continue as before.;;5228;O;;preference
q38004;Have you ever created a piece of art for a friend, just because you were thinking of them?;Yes.;No.;;;8861;O;;descriptive
q38020;Have you ever started your own business?;Yes.;No.;;;9405;O;;descriptive
q38021;Would you want a lover who is always open and direct about everything, if it means that you would also receive any crude negative feedback they may have for you?;Yes.;No.;;;5426;O;;preference
q38051;How often do you gamble?;Often.;Rarely.;Never.;;27266;O;;descriptive
q38072;Would it bother you if a date made gender-biased remarks?;Yes.;No.;Only if they were inaccurate.;;8311;O;2, 3, 1;"politics; preference"
q38094;How far would you be willing to travel to meet a person of interest who also has a high match percentage for you here on OkCupid?;Up to 20 miles (32km);21 to 100 miles (33 to 161km);101 to 500 miles (162 to 805km);More than 500 miles (805km);9554;O;;"preference; descriptive"
q38115;Would you object to someone bringing a young child along on a first date?;Yes.;No.;;;18637;O;;descriptive
q38173;Do you enjoy watching educational programming on television?;Yes, often.;Yes, on occasion.;No, never.;;25991;O;;descriptive
q38186;Is it ever okay to publicly argue with a significant other?;Yes.;No.;;;6329;O;;opinion
q38192;Do you get annoyed if someone uses a word or phrase incorrectly, even if you still understand the speaker's meaning?;Yes, and I'd correct them;Yes, but I wouldn't correct them;No, and I wouldn't correct them;No, but I'd still correct them;1335;O;(1, 2), (3, 4);descriptive
q38196;Regardless of where you grew up or now live, which of the following best describes the way you see yourself at heart?;I am an urban or city person.;I am a suburbanite.;I am small town or country person.;;26385;O;;descriptive
q38202;'The best days of my life' are:;In my future.;In my past.;Right now.;;11921;O;2, 3, 1;descriptive
q38210;After a date, have you ever told someone that you are going to call them, but not done it?;Yes.;No.;;;14696;O;;descriptive
q38214;Do you 'evaluate' the people you see out in public for suitability as potential partners, based on their attractiveness?;Yes.  I am very perceptive in this way.;No.  Never.;I only 'look' when I am available.;;1758;O;2, 3, 1;descriptive
q38223;Do you like to go clubbing?;Yes, I prefer to go alone.;Yes, I prefer to go with a date.;Yes, I prefer to go with friends.;No.  I do not like to go clubbing.;27207;N;;preference
q38230;Would you really like to stay home and spend an entire day (24 hours) in bed (getting up only for the necessities) with your ideal significant other?;Yes.;No.;;;23810;O;;preference
q38249;How well do you sleep when you're in unfamiliar surroundings?;Better than usual.;The same as usual.;Worse than usual.;;12218;O;;descriptive
q38263;Would you consider digging up the grave of a loved one to recover a priceless item that was accidentally buried with them?;Yes, I wouldn't hesitate, even if it were illegal.;Yes, but only if it could be done legally.;No, absolutely not.;;4971;O;;"preference; descriptive"
q38264;Might you be annoyed if someone asked you to repeat yourself?;Yes.;No.;It depends...;;4035;O;2, 3, 1;descriptive
q38296;If a significant other requested that you stop shaving or using other means of hair removal, is this something you would seriously consider?;Yes.;No.;I am already totally 'natural' in this way.;;3616;M;[3];"preference; descriptive"
q38320;Is it generally acceptable to you for a sex partner to initiate foreplay while you are sleeping?;Yes.;No.;;;26301;O;;sex/intimacy
q38423;What do you usually wear when you sleep?;Pajamas.;Underwear.;Nothing.;Something else.;26417;M;[4];descriptive
q38435;Do you read fan fiction?;Yes.;No.;I don't know.;;8599;O;2, 3, 1;descriptive
q38467;How many albums are there in your music collection?;1 to 100 albums.;101 to 300 albums.;301 or more albums.;I have no music albums.;18997;O;4, 1, 2, 3;descriptive
q38479;Imagine a law is passed that makes one of your favorite activities illegal.  Assuming you believe the activity to be harmless, would you continue pursuing it if there exists a high probability of eventually being caught?;Yes.;No.;;;2061;O;;politics
q38492;Would you be willing to lie on a job resume or application if you thought it would get you the job and you were sure you wouldn't get caught?;Yes.;No.;;;3893;O;;"descriptive; preference"
q38498;Which method do you most often use to acquire products from stores?;I usually pay with cash.;I usually pay with a check or debit card.;I usually pay with credit or a credit card.;I usually steal products rather than pay for them.;5980;N;;descriptive
q38508;Imagine that after becoming romantically involved with someone, they reveal that they formerly earned a living as a prostitute.  How would you react to this new information?;Positively.;Negatively.;Indifferently.;;9753;O;2, 3, 1;"politics; sex/intimacy; preference"
q38518;Do you enjoy using refrigerated items or ice cubes on your partner during sex?;Yes.;No.;I don't know.;;5216;O;2, 3, 1;sex/intimacy
q38534;Are you familiar with the concept of 'sexuality continuum'?;Yes - I basically agree with it.;Yes - I basically disagree with it.;No - I am not familiar with this idea.;;3016;O;2, 3, 1;"politics; sex/intimacy; religion/superstition; opinion"
q38555;How often were you picked on by other kids your age when you were growing up?;Very often.;Sometimes.;Rarely.;Never.;12527;O;;descriptive
q38578;If you had to choose one of the following, which best describes the role of sex in your life?;Sex is one of my favorite activities.;Sex is something I enjoy on occasion.;Sex is for procreation.;Sex is a means to getting things that I want.;15985;N;;sex/intimacy
q38623;Have you ever 'regifted' a gift you didn't like?;Yes.;No.;;;11221;O;;descriptive
q38646;If a significant other requested that you stop wearing antiperspirant or deodorant, is this something you would seriously consider?;Yes.;No.;I am already totally 'natural' in this way.;;5508;M;[3];"preference; descriptive"
q38653;Do you crack your knuckles?;Yes.;No.;;;11307;O;;descriptive
q38696;'The customer is always right.';True.;False.;;;5191;O;;opinion
q38710;If a significant other told you that they had two-way communication with the spirit of a dead relative, would you believe them?;Yes.;No.;;;5346;O;;religion/superstition
q38721;Imagine that you and your partner cannot agree on the choice of music.  If you were driving and your partner a passenger, how should the music be chosen?;I would play the music I like.;I would allow my partner to choose the music.;We should take turns choosing the music.;It would be best to keep the stereo off.;6281;M;2, 3, 1, [4];preference
q38767;Is it okay for men to wear makeup?;Yes;No;;;29029;O;;opinion
q38824;Have you ever raised an animal for food?;Yes.;No.;;;9492;O;;descriptive
q38838;Have you ever had sex with someone you first met online?;Yes.;No.;;;26290;O;;descriptive
q38912;How do you feel about germs?;Obsessed: I bleach anything I can't trust!;Careful: I wash my hands and cover my sneezes.;Polite: I always wash up when someone's watching.;Unconcerned: I don't actively lick doorknobs.;24415;O;;descriptive
q39147;Would you support assisted suicide/right-to-die legislation?;Yes.;No.;I don't know.;;10500;O;2, 3, 1;"politics; religion/superstition"
q39185;Which is more offensive: book burning or flag burning?;book burning;flag burning;;;36598;N;;politics
q39189;Would you date a recovering (non-drinking) alcoholic?;Yes.;No.;;;18075;O;;preference
q39210;Do you believe you've lived past lives?;Yes, I am confident I have.;No, I do not believe this is possible.;Maybe, but there is no way to really know.;;24152;O;2, 3, 1;religion/superstition
q39226;You stop to pick up a newspaper and notice that the coin-operated dispenser was not completely closed. No one is around so you have the opportunity to take a paper without paying. Which of the following would you do?;Pay for a paper and close the dispenser.;Steal a paper and close the dispenser.;Steal a paper and leave the dispenser open.;Steal all of the remaining papers.;2111;O;;"preference; descriptive"
