;text;option_1;option_2;option_3;option_4;N;Type;Order;Keywords
q50564;Have your sexual interests become kinkier as you've grown older?;Yes.;No, they haven't changed much.;No, just the opposite.;No, I have no sexual interests.;26137;M;[4];sex/intimacy
q50565;Do you blush easily?;Yes.;No.;;;12580;O;;descriptive
q50570;If there were no welfare programs available in your community, which would you choose to help?;Give money directly to poor people.;Give money to the government.;Give money to a charity.;Keep my money for myself, friends, and/or family.;2799;N;;politics
q50678;Do you like reading tabloids?;Yes.;No.;;;13890;O;;preference
q50734;Imagine that you live in a place where public nudity is not only legal, but also socially acceptable.  Assuming that the climate is favorable, how often would you be totally naked in public?;All of the time.;Frequently.;Occasionally.;Never.;8077;O;;"preference; descriptive"
q50737;Compared to what might be average for their gender and sexual orientation, do you prefer a partner to be more masculine or more feminine?;More masculine.;More feminine.;Average.;It would vary depending upon their gender.;13068;O;2, (3, 4), 1;"sex/intimacy; preference"
q50755;Do you believe that everything happens for a reason?;Yes.;No.;;;28223;O;;religion/superstition
q50759;Can you name your two closest neighbours?;Yes.;No.;;;9948;O;;descriptive
q50923;At the movies, do you stay for the credits?;Always.;Sometimes.;Never.;;19158;O;;descriptive
q50953;If someone murdered a close friend of yours, would you hope for the death penalty?;Yes.;No.;I'm not sure.;;11197;O;2, 3, 1;"politics; descriptive; preference"
q50990;Would you want to be immortal if you could?;Yes.;No.;;;6394;O;;preference
q50991;Do you feel that a major reduction of the human population is necessary for the long-term survival of the Earth?;Yes.;No.;I'm not sure.;;2239;O;2, 3, 1;"politics; opinion"
q51053;Do you think parents who smoke in cars with very young children should be punished?;Yes.;No.;;;5401;O;;politics
q51105;Do you consider it to be ethical to use the Internet to search for information about someone you have just begun dating?;Yes.;No.;;;2920;O;;opinion
q51155;If a distant member of your family found themselves homeless, would you take them in, even if you dont't have the money to support them?;Yes.;No.;Maybe, if they promised to somehow pay me.;Maybe, it depends on other factors.;2491;O;2, (3, 4), 1;descriptive
q51197;When eating, do you generally eat the things you like most first or save them for last?;I eat the things I like most first.;I eat the things I like most last.;I don't usually eat in a particular order.;;10436;O;2, 3, 1;descriptive
q51296;Do you feel a need to own the most up-to-date electronic gadgets?;Always.;Sometimes.;Never.;;19822;O;;preference
q51349;Is it possible for your partner to be too ambitious?;Yes.;No.;;;10945;O;;preference
q51354;Do you borrow books from public libraries?;Regularly.;Occasionally.;Never.;;17444;O;;descriptive
q51360;Do you think that masturbation is an acceptable practice?;Yes.;No, it is unhealthy.;No, it is against my beliefs.;No, it is both unhealthy and against my beliefs.;15555;O;4, (2, 3), 1;"sex/intimacy; religion/superstition"
q51373;Imagine that your partner enjoys smelling various parts of your body, especially after you had a long day or just exercised.  Would you want them to do so?;Yes.;No.;Only after I have taken steps to be clean.;;6967;O;2, 3, 1;preference
q51431;When it comes to getting what one deserves, which do you see as the bigger problem?;Someone not getting something they deserve.;Someone getting something they don't deserve.;;;2086;O;;opinion
q51470;Have you ever written a 'Letter to the Editor' in response to a news article?;Yes.;No.;;;7573;O;;descriptive
q51502;Assuming you were in the position to do so and asked to make the final decision, would you launch nuclear weapons under any circumstance?;Yes.;No.;;;7524;O;;politics
q51537;A deadly virus has spread across the globe.  You hold the only vial of antidote, which can not be reproduced.  Who do you give it to?;Yourself;Your spouse;Your child;No one, everyone else will die anyway;4249;N;;"preference; descriptive"
q51615;How often do you tell your platonic friends that you love them?;Almost every time I see them.;Occasionally.;Never.;;18253;O;;descriptive
q51774;What is your position on hunting?;I approve of hunting for food and sport.;I approve of hunting for food only.;I do not approve of hunting at all.;;15726;O;;opinion
q51800;Should people be allowed to sell their body parts, organs, and tissues for profit?;Yes.;No.;I'm not sure.;;1975;O;2, 3, 1;"politics; opinion"
q51829;If you could have one wish granted, who'd benefit most from it?;I would.;My family and friends would.;My nation would.;Everyone would.;6388;N;;"preference; descriptive"
q51833;What is the longest you have gone without sleep?;Less than 18 hours.;18 to 24 hours.;24 to 36 hours.;More than 36 hours.;14508;O;;descriptive
q51854;Which best describes the extent of your knowledge in terms of breadth and depth?;I have very deep knowlege of a narrow area.;I know a little about almost everything.;I know a lot about a lot.;I am basically stupid.;9392;N;;"descriptive; cognitive"
q51871;If you found out that someone you were interested in has several other people interested in them too, how would this affect your behavior?;I'd work harder to attract them.;I'd be less likely to try with them.;It would not affect my behavior.;;2970;O;2, 3, 1;descriptive
q51886;Do you think that a fourteen year old who commits a violent crime should be tried and punished as an adult?;Yes.;No.;I'm not sure.;;5495;O;2, 3, 1;politics
q51924;Do you think the world is overpopulated?;Yes.;No.;;;2073;O;;opinion
q51998;Overall, do you think feminism has had a positive or negative impact on human civilization?;Positive.;Negative.;Neither.;;9194;O;2, 3, 1;"politics; opinion"
q52144;If you knew with certainty that you could go to a wonderful afterlife and everything would be fantastic, would you kill yourself?;Yes.;No.;I'm not sure.;;3350;O;2, 3, 1;religion/superstition
q52170;Have you ever attempted to convert another to your own religious beliefs?;Yes.;No.;;;4574;O;;"religion/superstition; descriptive"
q52181;You're riding along in a friend's car when he or she throws some trash out the window.  How might you react?;I'd express my clear disapproval.;I'd make a disapproving sound or joke.;I wouldn't really care.;I'd throw my own trash out the window, too.;13950;O;;descriptive
q52431;Have you made plans to survive a natural or man-made disaster where you live?;Yes.;No.;;;10946;O;;descriptive
q52503;Should adults be required by law to wear seatbelts when riding as passengers in automobiles?;Yes.;No.;;;5714;O;;"politics; opinion"
q52645;Have you attended a drag queen/king show?;Yes, as a participant.;Yes, in the audience.;No, but I'd like to.;No, and I don't plan to.;8909;O;;descriptive
q52665;Which of the following is the most admirable endeavor?;Working to feed the homeless.;Working to preserve an endangered species.;Serving one's country in the military.;Devoting oneself to religious/spiritual pursuits.;9408;O;;"politics; religion/superstition; opinion"
q52682;If one of your potential matches were overweight, would that be a dealbreaker?;Yes, even if they were slightly overweight.;Yes, but only if they were obese.;No.;No, in fact I prefer overweight people.;40495;O;;preference
q52719;Should healthcare be funded by the government?;Yes, for everyone.;Yes, but only for certain people.;No.;I'm not sure.;13081;O;3, 4, 2, 1;politics
q52728;Which of these four is sexiest?;Someone who is good with language(s).;Someone who is logical or mathematical.;Someone who is physically skilled.;Someone who is musically skilled.;28519;N;;"preference; opinion"
q52771;Imagine you are on a sinking ship.  You can choose three people to go in a life raft, and you must pick from: (A) a relative you don't like, (B) your significant other, (C) your best friend, and (D) yourself.  Which three do you choose to save?;A, B, and C.;A, B, and D.;A, C, and D.;B, C, and D.;3474;N;;"preference; descriptive"
q52789;Which of the following do you consider to be the best explanation for the existence of human life on Earth?;Humans evolved from other species.;Humans were created by a higher power.;Humans were brought to Earth from the stars.;I'm not sure.;21323;N;;religion/superstition
q52827;Would you consider connecting with someone whose relationship status is 'seeing someone' or 'married'?;Yes to both;No to both;Yes to 'seeing someone' only;Yes to 'married' only;25032;O;2, (3, 4), 1;preference
q52868;Have you ever written a screenplay or stage play?;Yes, both.;No, neither.;Screenplay only.;Stage play only.;9417;O;2, (3, 4), 1;descriptive
q52884;Do you think that people who go to jail for serious crimes deserve a second chance out in the real world?;Yes.;No.;It depends on the crime.;;5222;O;2, 3, 1;politics
q52936;Do you enjoy creating mathematical problems to solve by yourself?;Yes.;No.;;;9819;O;;"preference; descriptive; cognitive"
q52938;Imagine you have just watched a fictional movie that is set sometime in the past.  Your friend begins to describe and explain why specific elements of the film are historically inaccurate.  Is this a discussion you would enjoy having?;Yes.;No.;;;2092;O;;"preference; descriptive"
q53076;How would you act if you were MUCH better than a match at something he/she is passionate about?;I'd openly flaunt my superior skill.;I'd downplay my skill to avoid upsetting him/her.;I'd be enthusiastic about our shared interest.;It depends on how secure or insecure he/she seems.;6419;N;;descriptive
q53155;Do you enjoy gardening?;Yes.;No.;I'm not sure.;;11823;O;2, 3, 1;descriptive
q53184;Do you think it is a good idea to use subdermal implants, which provide indentifying information, inside children's bodies?;Yes.;No.;I'm not sure.;;3219;O;2, 3, 1;"politics; opinion"
q53196;'Those who would sacrifice liberty for security deserve neither.'  Do you agree with this statement?;Yes.;No.;;;4955;O;;politics
q53260;If you were going to be marooned on a deserted tropical island, how big would you want the island to be?;Small (to know the entire island intimately);Medium (vast but familiar);Large (too big to explore all of it);;14947;O;;preference
q53282;How much would it bother you if someone spoiled the end of a novel you were reading?;I would be very annoyed.;I would be a little annoyed.;It would not bother me at all.;I don't read novels.;6994;M;[4];descriptive
q53299;Which type of education would you prefer for your children?;Public.;Private.;Religious.;Home.;25113;N;;"religion/superstition; preference"
q53312;Which of the following would you be most disturbed to find in a 13-year-old child's room?;Condoms.;Illegal drugs.;Pornography.;Weapons.;21972;N;;opinion
q53402;Do you usually feel the need to shower or bathe after having sex?;Yes.;No.;I've never had sex.;;24920;M;[3];sex/intimacy
q53426;When you have plans to meet someone at a certain time, it's best to be:;A little early.;A little late.;Precisely on time.;Whatever.;11026;M;2, 3, 1, [4];"preference; opinion"
q53509;How do you feel about crystal healing?;I think it works.;I think it's a load of crap.;I respect these beliefs, but it's not for me.;I'm not sure.;9729;O;2, (3, 4), 1;religion/superstition
q53540;Regardless of your actual age, do you consider yourself to be an adult?;Yes.;No.;Only some of the time.;;35857;O;2, 3, 1;descriptive
q53595;How often do you get upset during face-to-face conversations involving at least two other people?;Never.;Rarely.;Frequently.;Always.;2038;O;;descriptive
q53611;How often do you meditate?;Frequently.;Rarely.;Never.;;40623;O;;descriptive
q53629;Which is your favorite season?;Summer.;Fall.;Winter.;Spring.;23790;N;;"descriptive; preference"
q53716;Would it bother you if your partner had a hobby where they would occasionally seclude themselves for hours at a time?;Yes.;No.;;;3708;O;;"preference; descriptive"
q53814;Do you check to be certain all of the entry doors at your residence are locked before going to sleep?;Always.;Never.;Sometimes.;;4079;O;2, 3, 1;descriptive
q53832;If after years of being with a partner, you found out that they could not have children and would not be willing to adopt, would you want to stay with them?;Yes.;No.;I'm not sure.;;14133;O;2, 3, 1;"descriptive; preference"
q53846;Do you think the International Space Station would be a romantic place to travel to with a partner to exchange vows?;Yes.;No.;;;2440;O;;preference
q53858;Do you care whether or not humanity survives beyond your own lifetime?;Yes.  I hope it does.;Yes.  I hope it does not.;No.;;15719;O;2, 3, 1;"preference; descriptive"
q53865;Would you ever consider hiring a detective to find out if someone is cheating on you?;Yes.;No.;;;2303;O;;descriptive
q53888;Do you think that the psychological differences between human males and females are better explained by nature or nurture?;Nature.;Nurture.;The two play a nearly equal role.;I'm not sure.;2414;M;2, 3, 1, [4];"politics; opinion"
q53889;Do you believe that scientific investigation is the only effective method to gain meaningful knowledge about the universe?;Yes.;No.;I'm not sure.;;6855;O;2, 3, 1;"religion/superstition; opinion; cognitive"
q53903;How often do you make up and sing ditties?;Regularly.;Sometimes.;Never.;;12099;O;;descriptive
q53910;How often do you read before going to sleep?;Always.;Frequently.;Rarely.;Never.;19043;O;;descriptive
q53965;If you discovered a spider on the wall in your bedroom, which would you do?;Ignore it.;Kill it.;Catch it and put it outside.;Find someone else to deal with it.;30959;N;;descriptive
q53981;On average, do you think people of the world are too sexually repressed, not repressed enough, or just about right?;People are too sexually repressed.;People are too promiscuous.;People are just about right.;;9177;O;2, 3, 1;"sex/intimacy; opinion"
q54014;If you were to say to someone, 'Hi, how's it going?' (or some variation of this question), would you actually care about the person's answer?;Yes.;No.;It depends on the circumstances.;I don't greet people like that.;3691;M;2, 3, 1, [4];descriptive
q54016;Are you afraid of falling madly in love?;Yes.;No.;;;23850;O;;descriptive
q54020;Would you want to be there to take care of an ill partner?;Yes.;No.;It depends on the illness.;;3224;O;2, 3, 1;descriptive
q54023;If you were going to name a child, which of the following sounds most appealing?;A traditional culture-based name.;A name to honor a family member or friend.;A name after someone famous.;A unique or original name.;3465;N;;"preference; opinion"
q54040;Would you continue in a relationship if you knew your partner was faking their enjoyment of sex just to make you happy?;Yes.;No.;;;12769;O;;"sex/intimacy; preference; descriptive"
q54052;In general, how content are you with your own appearance?;Very content.;Somewhat content.;Not very content.;;25559;O;;descriptive
q54065;If medical science completely eliminated all sexually transmitted disease, how would this affect who you would have sex with?;I would have sex with MANY more people.;I would have sex with more people.;It would not affect who I have sex with.;I would have sex with fewer people.;10910;O;;sex/intimacy
q54067;Do you believe that victims of sex crimes have an obligation to report these crimes to the police?;Yes.;No.;;;4479;O;;"politics; opinion"
q54089;After meeting somebody new, is it acceptable to search the internet to find information about them?;Yes, this would be completely normal.;No, this would be inappropriate.;It depends...;;2983;O;2, 3, 1;opinion
q54090;Imagine that you are attacked on a dark street by someone brandishing a deadly weapon.  You defend yourself and are unhurt, but in doing so your actions kill the attacker.  You believe there were no witnesses.  Which would you do?;Continue as if nothing happened.;Notify the police.;Call a lawyer.;Attempt to dispose of any evidence and leave.;7104;N;;descriptive
q54105;Do you like putting together jigsaw puzzles?;Yes.;No.;;;9891;O;;"preference; descriptive"
q54127;Do you ever not feel like having sex because you feel too unattractive or too unappealing?;Yes, frequently.;Yes, sometimes.;Yes, but only rarely.;No, never.;26208;O;;descriptive
q54128;Would you like to go on a five night spiritual retreat?;Yes.;No.;;;6778;O;;religion/superstition
q54129;Have you ever written a song?;Yes.;No.;;;9978;O;;descriptive
q54150;Do you think you can tell how good someone is at sex by how they move on the dance floor?;Yes.;No.;;;9158;O;;opinion
q54354;Which of the following senses do you find sexiest?;Sight.;Smell or taste.;Hearing.;Touch.;17043;N;;opinion
q54371;You are painting your room and come across a very hard-to-reach spot, one that would take hours to get at and properly paint. This spot also happens to be completely hidden - nobody would ever know if you decided to skip it. What do you do?;Paint it.;Skip it.;;;18349;O;;descriptive
q54390;Would you find it a turn on or a turn off if the person you are dating could sing very well?;A turn on.;A turn off.;It would not affect me either way.;;3904;O;2, 3, 1;preference
q54450;Should people be allowed to use otherwise illegal drugs where doing so is consistent with their spiritual and/or religious beliefs?;Yes.;No.;;;8590;O;;religion/superstition
q54517;Are you sexually attracted to any inanimate objects?;Yes.;No.;;;20071;O;;"sex/intimacy; descriptive"
q54695;How clear to you are your goals in life?;Very clear.;Somewhat clear.;Not at all clear.;;25418;O;;descriptive
q54738;Do you think it is necessary for a man to have (or have had) a good relationship with his father in order to be a good father?;Yes.;No.;;;2786;O;;opinion
q54769;If you knew a coworker was stealing Post-It notes, but the two of you got along well, what would you do?;I'd turn them in.;I'd keep quiet.;I'd ask for half of the notes.;I'd use this information to blackmail my coworker.;1683;N;;descriptive
q54786;Does it bother you when people sing the wrong words to a popular song?;Yes.;No.;;;13490;O;;"descriptive; opinion"
q54813;How many siblings (brothers and sisters) do you have?;None.;One.;Two or three.;Four or more.;18079;O;;descriptive
q54846;Would you consider dating somebody who publishes the most intimate details of their relationships in their blog?;Yes.;No.;;;5228;O;;"preference; descriptive"
q54871;Do you believe that adults should be able to carry firearms in public?;Yes.;No.;;;13484;O;;politics
q55007;If you borrowed a car with a handicapped plate/tag/sticker, but you were not handicapped, would you take advantage and park in a designated handicapped spot?;Yes.;No.;;;2977;O;;descriptive
q55117;Imagine you are at a social event and your partner says something you disagree with strongly.  Which of the following would you most likely do?;I'd support them even though I disagree.;I'd just keep quiet.;I'd politely disagree.;I'd argue my point aggressively.;10127;O;;descriptive
q55156;Have you ever given an answer on a test or quiz that you knew with perfect certainty to be correct, even though you were confident another answer was expected and that your 'correct choice' would not receive credit?;Yes.;No.;;;8380;O;;descriptive
q55169;Do you think boys should be circumcised?;Yes.;No.;I'm not sure.;;10516;O;2, 3, 1;"politics; religion/superstition; opinion"
q55180;Do you often find that movies widely considered classics are really just over-rated?;Yes.;No.;;;10854;O;;opinion
q55185;In terms of birth order, which are you?;The oldest child.;The youngest child.;Somewhere in the middle.;All of the above.;23076;M;[4];descriptive
q55264;Do you think that a person's musical preferences are a good indicator of intelligence?;Yes.;No.;;;24782;O;;opinion
q55344;Would it be a good idea to pass a law requiring people to take a course and pass a test before being allowed to have a child?;Yes.;No.;;;10006;O;;politics
q55347;How often do you visit the dentist to have your teeth (or tooth) cleaned?;I go at least twice a year.;I go about once a year.;I usually wait two years or longer between visits.;I do not visit the dentist for cleanings.;3199;O;;descriptive
q55348;Can you recite your favorite poem from memory?;Yes.;No.;I don't have a favorite poem.;;20657;M;[3];descriptive
q55349;Have you ever thrown an object in anger during an argument?;Yes.;No.;;;18188;O;;descriptive
q55354;If you found a house that you really liked, would the fact that a brutal murder took place there ten years before stop you from buying it?;Yes.;No.;;;4455;O;;descriptive
q55355;Do you have a problem with people who wear fur clothing?;Yes.;No.;;;24055;O;;politics
q55416;Assuming you have reached the point where you exchanged real contact information, would you be comfortable if a potential match had a background check run on you?;Yes.;No.;;;7469;O;;"preference; descriptive"
q55481;Do you think it is acceptable for a person to stand naked in their own window so that people outside can see them?;Yes.;No.;It depends on what they look like.;I'm not sure.;3790;O;2, (3, 4), 1;opinion
q55483;In some locations, TV networks use warning systems to flag sexual, violent and profain content in programs so parents can better protect children.  Do you think similar warnings should exist for religious content?;Yes.;No.;There should be no TV parental guidelines at all.;;4493;O;;"politics; religion/superstition; opinion"
q55587;Would you be comfortable having a partner whose job requires them to be physically close to very attractive people?;Yes.;No.;;;2566;O;;"preference; descriptive"
q55613;When it comes to activities and hobbies, do you more often participate in those which are traditionally thought of as male or female?;Mostly male.;Mostly female.;Equally male and female.;Neither male nor female.;960;M;2, 3, 1, [4];descriptive
q55669;When you offer criticism, how is it most often received?;As constructive.;As destructive.;Some of both - It depends upon the situation.;I don't offer criticism.;3981;M;2, 3, 1, [4];descriptive
q55744;If you were going to have a child, would you want the other parent to be of the same ethnicity as you?;Yes.;No.;This would not be an important factor to me.;;40629;O;2, 3, 1;"descriptive; preference"
q55760;How long would a relationship have to last before you would consider seeing a counselor to resolve problems?;Less than one year.;One to three years.;More than three years.;I would never submit to relationship counseling.;4390;O;;descriptive
q55814;Imagine that a friend sets you up on a blind date that sounds like a perfect match, except for one problem: the date neither speaks nor understands any languages that you do. This is:;A deal breaker. The date gets called off.;A pretty big issue, but I'd still go on the date.;Awesome!;;4591;O;;preference
q55929;Historically, have you gone through periods of 'forgetting about your friends' as you have become involved in romantic relationships?;Yes.;No.;I'm not sure.;I've never been in a romantic relationship.;2688;M;2, 3, 1, [4];descriptive
q55953;What would you think of a romantic prospect who uses childish language when being affectionate?;I'd like it.;I wouldn't like it.;It would depend upon the situation.;;5641;O;2, 3, 1;preference
q55980;Would you like to be the supreme ruler of all people on Earth?;Yes.;No.;;;23410;O;;preference
q55981;If a company contacted you as a reference for a friend who is applying for a job, would you consider lying to help your friend get the job?;Yes.;No.;;;7165;O;;descriptive
q56014;Ideally, what portion of your total hobbies and other recreational activities would you like to share as common with a partner?;All.;None.;Up to one-half.;More than one-half.;15134;O;2, 3, 4, 1;descriptive
q56137;When it comes to gambling, which is closest to your style?;Cautious.;Aggressive.;Somewhere in the middle.;I don't gamble.;8631;M;2, 3, 1, [4];descriptive
q56145;How do you generally feel about people who tend to hug others whom they've just met?;More positive than negative.;More negative than positive.;Indifferent.;;22190;O;2, 3, 1;opinion
q56151;How would you react if your lover called you by the name of their ex?;I'd get mad and/or dump him/her.;I'd pretend I didn't hear.;I'd laugh about it/wouldn't really care.;I'd talk to him/her about it.;10425;O;;descriptive
q56163;If after having a nice chat with someone online, they seem to be ignoring you completely the next day.  Which would be closest to your reaction?;I'd try to contact them repeatedly.;I'd be hopeful that they would make the next move.;I'd assume they're busy and leave them alone.;I'd ignore them from now on.;4736;O;;descriptive
q56172;Is someone who speaks several languages fluently more attractive to you than someone who does not?;Yes.;No.;;;1901;O;;"preference; opinion"
q56345;A 200 year life span. Blessing or curse?;Give it to me.;No thanks.;;;2784;O;;"preference; opinion"
q56459;Imagine your partner enjoys getting naked in public places where nudity is not socially acceptable.  This would be:;A turn-on.;A turn-off.;Irrelevant.;;4075;O;2, 3, 1;"preference; opinion"
q56493;Which of the following forms of poetry best resembles what you desire in a relationship?;A Sonnet - Controlled, deliberate, and surprising.;A Haiku - Short, simple, and vivid.;An Epic - Long, meandering, and powerful.;Free Verse - Wild, shifting, and confusing.;4687;N;;"descriptive; preference"
q56606;How interested would you be in knowing the details of a partner's sexual history?;Very interested.;Somewhat interested.;Not interested.;;29116;O;;"sex/intimacy; descriptive"
q56607;If you previously had a sexually transmitted disease of which you have been completely cured and can no longer pass on, would you disclose this information to partners before having sex with them?;Yes.;No.;I'm not sure.;;9644;O;2, 3, 1;sex/intimacy
