;text;option_1;option_2;option_3;option_4;N;Type;Order;Keywords
q2;Breast implants?;more cool than pathetic;more pathetic than cool;;;24839;N;;"sex/intimacy; preference; opinion"
q11;How does the idea of being slapped hard in the face during sex make you feel?;Horrified;Aroused;Nostalgic;Indifferent;28860;N;;sex/intimacy
q12;Divide your age by 2.  Have you had sex with at least that many people?;Yes;No;;;22496;O;;sex/intimacy
q13;Is a girl who's slept with 100 guys a bad person?;Yes;No;;;32581;O;;sex/intimacy
q14;Is a guy who's slept with 100 girls a bad person?;Yes;No;;;31127;O;;sex/intimacy
q16;Should sex with someone 16 years old be a jailable offense, if you're 25 or older?;Yes;No;;;8341;O;;sex/intimacy
q17;Would you date someone just for the sex?;Yes;No;;;38180;O;;sex/intimacy
q18;Do you have experience being in a slave/master relationship?;Yes;No;;;21686;O;;"sex/intimacy; BDSM"
q20;BDSM: Without looking it up, do you know exactly what it stands for?;Yes;No;;;16643;O;;"sex/intimacy; BDSM"
q21;Do you enjoy meaningless sex?;Yes;No;;;31024;O;;sex/intimacy
q22;Do you read erotic fiction?;Yes;No;;;18677;O;;sex/intimacy
q24;Is it wrong to watch pornographic films if you're in a relationship?;Yes;No;;;16666;O;;sex/intimacy
q25;Would you watch a porno movie with your ideal match?;Yes;No;;;13987;O;;sex/intimacy
q26;Have you ever owned sex toys?;Yes;No;;;25010;O;;sex/intimacy
q27;Which is a bigger deal for you?;Telling someone you really care;Oral sex;;;24749;O;;sex/intimacy
q28;Would you dump someone simply because they weren't good at sex?;Yes;No;;;30477;O;;sex/intimacy
q29;Would you rather:;be tied up during sex;do the tying;avoid bondage all together;;30567;N;;"sex/intimacy; BDSM"
q30;Would you like to receive pain during sex?;Yes, lots and lots;Yes, some;No;;32084;O;;"sex/intimacy; BDSM"
q32;Group sex (with 3 or more people):;I have tried it.;It seriously interests me.;I have little or no interest.;;32816;O;;sex/intimacy
q33;Do you like kissing in public?;Yes;No;;;23004;O;;sex/intimacy
q34;Are you more horny or more lonely?;Horny;Lonely;;;23592;N;;sex/intimacy
q35;Regardless of future plans, what's more interesting to you right now?;Sex;Love;;;50384;N;;sex/intimacy
q36;Would you ever consider an open marriage? That means you can sleep with other people.;Yes;No;;;16649;O;;sex/intimacy
q37;How old were you when you lost your virginity?;Under 18;18 or Over;I never have!;;19511;O;;sex/intimacy
q38;Would you ever take your family to a nude beach?;Yes;No;;;5530;O;;sex/intimacy
q39;Would you let your children under 13 watch movies with full nudity?;Yes;No;;;26933;O;;sex/intimacy
q41;How important is religion/God in your life?;Extremely important;Somewhat important;Not very important;Not at all important;54140;O;;religion/superstition
q42;Is your duty to religion/God the most important thing in your life?;Yes;No;;;16024;O;;religion/superstition
q43;Do you believe in some kind of a spiritual, cosmic force outside the realm of most modern religion?;Yes;No;;;6595;O;;religion/superstition
q44;Some religions are more correct than others.;True;False;;;29109;O;;religion/superstition
q45;Do you believe in ghosts?;Yes;No;;;21619;O;;religion/superstition
q46;Would you prefer good things happened, or interesting things?;Good;Interesting;;;52112;N;;preference
q48;Which would you rather be?;Normal;Weird;;;52464;N;;preference
q49;Which word describes you better?;Carefree;Intense;;;49827;N;;descriptive
q50;Have you ever seen a therapist?;Yes;No;;;9507;O;;descriptive
q51;Do you think really abstract art—like just splattered paint—can be truly brilliant?;Yes;No;;;18314;O;;opinion
q53;When telling stories, do you like to exaggerate?;Yes;No;;;12586;O;;preference
q54;Which, on you, is closest to perfection?;Your mind;Your body;Your wallet;Your soul;22704;N;;"religion/superstition; descriptive"
q55;Does the idea of flipping a coin to make important life decisions appeal to you?;Yes;No;;;34393;O;;preference
q56;Are you attracted to dangerous situations?;Yes;No;;;39510;O;;preference
q57;Do you like to argue?;Yes;No;;;33896;O;;preference
q60;Which describes you better?;Warm-hearted;Cool-headed;;;21205;O;;descriptive
q61;Are you a better conversationalist or listener?;Conversationalist;Listener;;;3174;O;;descriptive
q63;Which word describes you better?;Private;Social;;;23765;O;;descriptive
q64;Which is more important in a healthy relationship?;Maintaining privacy;Total openness;;;24393;O;;sex/intimacy
q65;Do you have a problem with racist jokes?;Yes;No;;;38041;O;;preference
q67;Are you modest?;Yes;No;;;5596;O;;descriptive
q68;Are you a highly skilled writer?;Yes;No;;;9320;O;;descriptive
q69;Are you more of a fast or careful talker?;Fast;Careful;;;12184;O;;descriptive
q70;Do you think homosexuality is a sin?;Yes;No;;;48983;O;;religion/superstition
q71;Is interracial marriage a bad idea?;Yes;No;;;32492;O;;politics
q73;Would you rather live in the big city or a small town?;Big city;Small town;;;28084;O;;preference
q74;Do you spend more money on clothes or food?;Clothes;Food;;;33168;N;;preference
q75;How do you like your social plans?;Settled and decided;Tentative;;;16121;O;;preference
q77;How frequently do you drink alcohol?;Very often;Sometimes;Rarely;Never;52467;O;;descriptive
q78;Generally, do you enjoy being drunk?;Yes;No;I don't know, because I've never been drunk.;;30487;M;[3];preference
q79;What's your relationship with marijuana?;I smoke regularly.;I smoke occasionally.;I smoked in the past, but no longer.;Never.;49796;O;;descriptive
q80;What's your deal with harder drugs (stuff beyond pot)?;I do drugs regularly.;I do drugs occasionally.;I've done drugs in the past, but no longer.;I never do drugs.;50107;O;;descriptive
q81;How much do you go 'clubbing' (out dancing in bars)?;Lots;Sometimes;Rarely;Never;31984;O;;descriptive
q82;Have you ever tried Yoga?;Yes;No;;;13960;O;;descriptive
q83;Do you enjoy gossip?;Yes;No;;;15402;O;;preference
q84;Do you regularly go out partying on weeknights?;Yes;No;;;22078;O;;descriptive
q86;Do you own a gun?;Yes;No;;;25688;O;;descriptive
q88;How messy are you?;I'm very messy;I'm average;I'm mostly organized;I'm compulsively neat;26579;O;;descriptive
q90;On a daily basis, do you spend a lot of time trying to make yourself look good?;Yes;No;;;15743;O;;descriptive
q91;Honestly, which do you do more of?;Watch television;Read;;;23830;N;;descriptive
q92;Your friends are:;mostly guys;mostly girls;both guys and girls;;8647;O;1, 3, 2;descriptive
q93;Generally, in life, what makes you happier?;Quality;Variety;;;21406;O;;"preference; opinion"
q94;Are you almost always on time?;Yes;No;;;22041;O;;descriptive
q95;Do you regularly paint or sculpt?;Yes;No;;;8941;O;;descriptive
q96;Are you, or have you ever been, in a band?  (A solo act is fine, too. Don't count school bands.);Yes;No;;;10925;O;;descriptive
q97;Do you write poetry?;Yes;No;;;9999;O;;descriptive
q102;Do you like to play contact sports?;Yes;I do, but I don't play much anymore.;No;;13173;O;;preference
q105;Do you have a child or children?;Yes;No;;;31097;O;;descriptive
q106;Have you ever been married?;Yes;No;;;28994;O;;descriptive
q109;Could you name 5 impressionists, and a painting by each?;Yes;No;;;7998;O;;descriptive
q110;Can you name 5 operas, and their composers?;Yes;No;;;11074;O;;descriptive
q111;Can you name any ballet other than the Nutcracker?;Yes;No;;;10630;O;;descriptive
q112;Would you travel around a third world country, alone?;Yes;No;;;5715;O;;descriptive
q113;Have you ever traveled around another country alone?;Yes;No;;;18395;O;;descriptive
q114;Is it okay to live with someone you're dating, even before you're engaged or married?;Yes;No;;;30969;O;;"sex/intimacy; opinion"
q115;Do animals have 'souls' like humans do?;Yes;No;;;6871;O;;religion/superstition
q116;Is evil necessary in the world?;Yes;No;;;6462;O;;"religion/superstition; opinion"
q122;How much does physical attractiveness matter to you in a match?;A lot;A little;Not at all;;36797;O;;preference
q123;Would you strongly prefer to go out with someone of your own skin color / racial background?;Yes;No;;;53312;O;;preference
q124;Do you work out a lot?;Yes;No;;;26934;O;;descriptive
q125;Do you lift weights?;Yes;No;;;12988;O;;descriptive
q126;What kind of shape are you in?;Great;Average;Shitty;;26252;O;;descriptive
q127;Do you wear expensive designer clothes?;Yes;No;;;14566;O;;descriptive
q128;Do you have any tattoos?;I have 1 or more BIG tattoos;I have 1 or more LITTLE tattoos;I have no tattoos;;40450;O;;descriptive
q129;Do you have any 'extreme' piercings (this includes anything other than ears, nose, or navel)?;Yes;No;;;22019;O;;descriptive
q130;Do you look better dressed or naked?;Dressed;Naked;;;13263;O;;descriptive
q132;Can you run a mile without stopping?;Yes;No;Yes - And More;;22862;O;3, 1, 2;descriptive
q133;Are you physically strong?;Yes, very;Average;No, not really;;17136;O;;descriptive
q134;Do you think women have an obligation to keep their legs shaved?;Yes;No;;;40673;O;;preference
q135;All else the same, would you rather date someone rich or hot?;Rich;Hot;;;10348;O;;preference
q136;Would you get upset if your girlfriend/boyfriend flirted in front of you?;Yes;No;;;36168;O;;"sex/intimacy; preference; descriptive"
q137;Would you terminate a pregnancy if the baby was going to be mentally disabled?;Yes;No;It depends on the severity;;10702;O;1, 3, 2;"preference; descriptive"
q140;If you had to guess, do you think humans will go extinct in the next 1000 years?;Yes;No;;;11600;O;;preference
q141;Would you be happy raising the kids while your spouse worked?;Yes;No;;;20675;O;;preference
q142;Is it possible to love someone you don't even like?;Yes;No;;;22947;O;;"sex/intimacy; opinion"
q144;Would you ever sleep with a serial killer?;Yes;No;;;12199;O;;"sex/intimacy; preference"
q146;Choose the better romantic activity:;Kissing in Paris;Kissing in a tent, in the woods;;;39103;N;;"sex/intimacy; preference"
q148;Would you rather know everything about your mate, or be regularly surprised?;Surprised;All-knowing;;;18338;O;;preference
q149;Which makes for a better relationship?;Passion;Dedication;;;49355;N;;sex/intimacy
q152;If you had a one-night stand DURING a relationship, would you confess to your mate?;Yes;No;;;16792;O;;"sex/intimacy; descriptive"
q153;Pick the best date on this list:;A really nice restaurant;A really divey bar;A day at the beach;;28688;N;;"sex/intimacy; preference"
q154;In a certain light, wouldn't nuclear war be exciting?;Yes, it would.;No, it wouldn't.;;;50514;O;;opinion
q155;Would you ever seriously date someone twice your age?;Yes;No;;;26336;O;;preference
q156;Would you ever seriously date someone half your age?;Yes;No;;;13922;O;;preference
q157;Do you have your own web page?;Yes;No;;;8471;O;;descriptive
q158;Are you an aspiring actor/artist/writer or other creative type?;Yes;No;;;40052;O;;descriptive
q159;Do you know any programming languages?;Yes;No;;;9709;O;;descriptive
q160;Which is more appealing?;A life of leisure;A life of accomplishment;;;21160;O;;"preference; opinion"
q161;Would you rather have more money or more freedom?;More money;More freedom;;;21440;O;;"preference; opinion"
q163;If a poor 20 year-old woman marries a wealthy 40 year-old man, do you assume it's for the money?;Yes;No;;;13647;O;;descriptive
q164;Do you wear a suit to work (or female equivalent)?;Yes;No;;;10944;O;;descriptive
q165;Are you totally anti-war?;Yes;No;;;14938;O;;descriptive
q166;Politically, which way do you lean?;To the right (republican in the US);To the left (democrat in the US);To the middle / I don't know;;11714;O;1, 3, 2;politics
q167;Do you recycle?;Almost always;Sometimes;Rarely or not at all;;24586;O;;politics
q168;The life of one of your fellow citizens is more valuable than the lives of ten foreigners.;True;False;;;22138;O;;politics
q169;Should the death penalty be abolished?;Yes;No;;;16884;O;;politics
q170;Do you usually vote in presidential (or applicable) elections?;Yes;No;;;18395;O;;politics
q171;What's more important to you?;Your world;Your country;;;25571;O;;"politics; preference"
q172;Would you fight for your country in an unjust war?;Yes;No;;;11718;O;;"politics; preference"
q173;Let's say you don't agree with a law, one that won't change. Which is your responsibility?;Breaking it when it suits you;Obeying it until it changes;;;3532;O;;"politics; opinion"
q174;Communism, in concept:;Good;Bad;Same as capitalism;No idea / this question doesn't interest me;19406;N;;politics
q175;Should burning your country's flag be illegal?;Yes;No;;;45720;O;;politics
q177;Which better explains why most homeless people are homeless?;Sheer laziness;Impossible odds;;;1975;O;;"politics; opinion"
q178;Which is bigger?;The earth;The sun;;;46727;N;;cognitive
q179;Who's smarter on average?;Men;Women;Neither, they're the same on average;;23841;O;1, 3, 2;opinion
q180;Have you ever cheated on an exam?;Yes;No;;;15581;O;;descriptive
q182;Have you ever studied math BEYOND calculus?;Yes;No;;;12937;O;;"descriptive; cognitive"
q183;Are you smarter than all your friends?;Yes;No;;;12145;O;;"descriptive; cognitive"
q185;Are you really into Anime (Japanese Animation) movies?;Yes;No;;;23792;O;;descriptive
q186;If you got married, would you change your name?;Yes;No;;;24230;O;;"preference; descriptive"
q187;In high school, were you one of the 'cool' kids?;Yes;No;;;11263;O;;descriptive
q190;Do you keep a blog (online journal)?;Yes.;No.;;;8822;O;;descriptive
q191;Could you imagine yourself killing someone?;Yes;No;;;9150;O;;descriptive
q192;Do you believe in dinosaurs?;Yes;No;;;19833;O;;religion/superstition
q193;Do you say grace before meals?;Yes;No;;;23814;O;;religion/superstition
q196;Excluding childhood fights, have you ever punched someone in the face?;Yes;No;;;18128;O;;descriptive
q198;Do you think advanced primates, like chimps and apes, should be afforded some degree of 'human' rights?;Yes;No;;;2348;O;;"politics; opinion"
q199;Do you know the square root of 256 off the top of your head?;Yes;No;;;11673;O;;cognitive
q201;Suppose you're driving, and you hit an animal. You don't know how badly it's hurt. Do you:;stop and look;keep going;;;14113;N;;descriptive
q202;For a pet, would you prefer:;one from the pound;one from a champion breeder;;;13918;N;;preference
q204;Which would you rather lose:;the ability to reproduce;the ability to orgasm;;;13858;N;;"sex/intimacy; preference"
q205;Do you think bodily fluids are inherently gross?;Yes;No;;;19550;O;;"sex/intimacy; opinion"
q206;Have you ever cybered (had cybersex)?;Yes;No;;;19343;O;;sex/intimacy
q209;Will you teach your children to believe in Santa?;Yes;No;;;26138;O;;religion/superstition
q210;Do you believe in God?;Yes;No;;;35015;O;;religion/superstition
q211;Do you think reptiles are cool?;Yes;No;;;13540;O;;opinion
q212;Do you sleep with a stuffed animal?;Yes;No;;;13604;O;;descriptive
q213;Are some human lives worth more than others?;Yes;No;;;28215;O;;"politics; opinion"
q214;Overall, has capitalism made the world a better place?;Yes;No;;;21838;O;;"politics; opinion"
q215;Which would you rather master?;art;science;;;21672;N;;preference
q216;Star Trek: cool or uncool?;Cool;Uncool;;;21756;O;;opinion
q218;Should prostitution be legal?;Yes, absolutely;Yes, only if it were regulated;I don't think so;ABSOLUTELY NOT;25694;O;;"politics; religion/superstition"
q219;Gay marraige: should it be legal?;Yes;No;;;33413;O;;religion/superstition
q220;Do you like to watch sports on television?;Yes;No;;;28763;O;;preference
q222;Do you think taxes are justified?;Yes;No;;;5804;O;;politics
q223;Do you believe that wealth in America is fairly distributed?;Yes;No;;;1687;O;;politics
q224;If you could triple your money by investing in a company whose business practices you disapproved of, would you invest?;Yes;No;;;2936;O;;"preference; descriptive"
q225;Do you think Christians are persecuted in the U.S.?;Yes;No;;;2937;O;;"politics; religion/superstition"
q226;Which would you rather lose?;the right to bear arms;the right to vote;;;30519;N;;"politics; preference"
q227;Do you like sex toys?;Yes;No;;;9324;O;;sex/intimacy
q229;Do you think humans have enough respect for the Earth's other species?;Yes, too much;Yes, about right;No;;16960;O;;"politics; opinion"
q231;Cell phones: good or evil?;Good;Evil;;;16354;O;;"opinion; technology"
q234;Does fashion matter to you?;A lot;A little;Not at all;;26847;O;;preference
q241;Are your parents ugly???;Yes;No;;;6649;O;;"opinion; descriptive"
q242;Are your birth parents divorced?;Yes;No;They were never married!;;18343;N;;descriptive
q244;Do you listen to conservative talk radio?;Yes;No;;;17878;O;;"politics; preference"
q246;Which describes you better?;Confrontational;Non-confrontational;;;20854;O;;descriptive
q249;Could you do 25 pushups without stopping?;Yes;No;;;11451;O;;descriptive
q250;Do you like being in a car with someone else who's driving extremely fast?;Yes;No;;;19190;O;;preference
q252;Have you ever been arrested, even if just for a small crime or misdemeanor?;Yes;No;;;12456;O;;descriptive
q254;Have you ever skied, snowboarded, surfed, or wind-surfed?;Yes;No;;;11333;O;;descriptive
q255;STALE is to STEAL as 89475 is to...;89457;98547;89754;89547;45868;N;;cognitive
q256;When birds stand on power lines and don't get hurt, it's most likely because of:;Good timing, they only land between calls;Body materials that are insulated from current;Not touching anything else at the same time;They do get hurt, they just express it poorly;14406;N;;cognitive
q258;Did America really put a man on the moon?;Yes;No;;;17067;O;;politics
q262;Most claims of sexual harrassment in the workplace are LIES made up by a scorned woman.;True;False;I don't know;;6353;O;1, 3, 2;"politics; opinion"
q265;Who do you think was smartest on this list?;Einstein;Shakespeare;Mozart;Jesus;29398;N;;opinion
q266;Do you have a favorite sports team that you really like to follow?;Yes;No;;;21527;O;;descriptive
q267;If some men are doctors and some doctors are tall, does it follow that some men are tall?;Yes;No;;;25094;O;;cognitive
q268;Do you enjoy fantasy books or movies? (e.g. The Lord of the Rings);Yes;No;;;19242;O;;"preference; descriptive"
q271;Think quick!;3.14159;3.14195;3.14519;3.14591;2533;N;;cognitive
q273;Do you know how to drive a stick shift (manual transmission)?;Yes;No;;;16737;O;;descriptive
q274;What's the highest level of education you've completed?;Graduate School;College;High School;Junior High;31706;O;;descriptive
q275;Are you a virgin?;Yes;No;;;29250;O;;"sex/intimacy; descriptive"
q277;Would you rather live forever or die happy?;Live forever;Die happy;;;4580;O;;preference
q278;How good is your singing voice?;Really awesome, actually;Very good;Okay;Crappy;15965;O;;descriptive
q279;Based on its involvement in world affairs (past and present), do you think the United States deserves to get attacked by terrorists?;Yes;No;;;6092;O;;politics
q280;Do you like the taste of blood?;Yes;No;;;21771;O;;preference
q283;Would you give the police significantly more power, if it would lower crime rates?;Yes;No;;;3547;O;;"politics; preference"
q284;Would you cut off your own good hand, if you knew it would magically solve poverty in the world?;Yes;No;;;3897;O;;"politics; preference"
q286;Which are you MORE of?;Talented;Hardworking;;;14276;O;;descriptive
q288;What's a worse trait to have?;Greed;Laziness;;;14614;N;;opinion
q291;Would you prefer it if fashion models were the same size and bodytype as the average citizen?;Yes;No;;;13740;O;;"politics; preference"
q293;Overall, do you think men should act more like women, or women should act more like men?;Women need to learn to act like men.;Men need to learn to act like women.;No one should change.;The premise of this question angers me.;5623;M;1, 3, 2, [4];"politics; opinion"
q294;Which is more important for a good match?;Having similar political beliefs;Having good sex;;;26731;O;;"politics; preference; opinion; sex/intimacy"
q297;Would you like to date someone a lot purer than you?;Yes;No;;;2908;O;;preference
q298;If possible, would you prefer to date someone a lot more attractive than you, or about the same?;A lot more attractive;About the same;;;8356;O;;preference
q301;Are you annoyed by people who are super logical?;Yes;No;;;35878;O;;preference
q303;If you unscramble the letters in 'laity', what do you get?;A country;A mountain;A river;A planet;10001;N;;cognitive
q304;Do you hit the snooze button more than once on a typical morning?;Yes;No;;;17666;O;;descriptive
q305;Goth chicks?;Sexy;Lame;I don't know;;21558;O;1, 3, 2;"preference; opinion"
q307;Do you like wild parties?;Yes;No;;;27957;O;;preference
q308;If you like someone a lot, do you usually ask them out?;Yes;No;;;37597;O;;descriptive
q309;Have you ever had a true one-night stand? (You met someone, had sex that night, and never contacted each other again.);Yes;No;;;28425;O;;"sex/intimacy; descriptive"
q311;When you're around new people, are you more of a leader, or are you more cooperative?;More of a leader;More cooperative;;;12195;O;;descriptive
q312;Are you likely to make long, friendly conversation with strangers?;Yes;No;;;11938;O;;descriptive
q314;When fooling around with someone, do you sometimes have sexual fantasies about other people?;Yes;No;;;18481;O;;"sex/intimacy; descriptive"
q315;Would you donate one of your kidneys (assume  you have 2) to save a child you didn't know?;Yes;No;;;979;O;;descriptive
q316;Have you ever read Shakespeare, other than for a class?;Yes;No;;;12464;O;;descriptive
q318;How important is money/wealth for you in a match?;Very important;Somewhat important;Not important at all;;35375;O;;preference
q320;Do you tend to blow off your responsibilities?;Yes;No;;;13128;O;;descriptive
q321;Generally speaking, are you a worrier?;Yes;No;;;14765;O;;descriptive
q322;Do you try to draw attention to your body by wearing seductive clothing?;Yes;No;;;18597;O;;descriptive
q323;How confident are you in your sexual abilities?;Super confident;Confident;Not really confident;;31389;O;;"sex/intimacy; descriptive"
q324;Orgasms are clearly the most important part of sex.;I agree.;I disagree.;;;34643;O;;"sex/intimacy; opinion"
q325;Would you consider having an open relationship (i.e., one where you can see other people)?;Yes;No;;;54443;O;;"sex/intimacy; preference"
q326;Should your mate also become your best friend?;Yes;No;;;18189;O;;"sex/intimacy; preference"
q327;How does having sex with someone usually affect your emotional attachment to them?;I become more attached.;I become less attached.;I told you. I'm a virgin.;It stays about the same.;18631;M;2, 4, 1, [3];sex/intimacy
q328;If you saw someone shoplifting, would you turn them in?;Yes;No;;;2382;O;;descriptive
q332;Would you ever date someone who's had cosmetic surgery?;Yes;No;;;11651;O;;"descriptive; preference"
q333;Would you ever sleep with a porn star?;Yes;No;;;13960;O;;"sex/intimacy; preference"
q334;Do you usually wear cologne or perfume?;Yes;No;;;23846;O;;descriptive
q335;Do you (or would you) like to go hunting?;Yes;No;;;25464;O;;"preference; descriptive"
q337;Without using a dictionary or other tool, can you choose the commonly misspelled word? Don't cheat! It's okay if you don't know.;Separate;Definate;Committee;(Not sure / dumb question / who cares);21319;N;;cognitive
q338;How does your maturity level compare with most people your age?;I'm more mature;I'm average;I'm less mature;;29286;O;;descriptive
q339;Do you like reggae music a lot?;Yes;No;;;12467;O;;descriptive
q340;Do you think angry or pornographic music lyrics should be kept, by law, away from kids?;Yes;No;;;12407;O;;politics
q341;Regardless of whether or not you smoke marijuana, do you think it should be legalized for adults?;Yes;No;;;32473;O;;politics
q342;Do you like stand-up comedy?;Yes;No;;;11389;O;;preference
q344;Do most politicians really want to make the world a better place?;Yes;No;;;11304;O;;"politics; opinion"
q346;Have you performed any charity work in the last year? (We mean labor, not donating money);Yes;No;;;8600;O;;descriptive
q347;Would you, or did you, go to your 10-year high school reunion?;Yes;No, but I wanted to;No;;11553;O;;"preference; descriptive"
q348;Which do you like more? Be honest.;Giving massages;Receiving massages;;;21082;O;;"preference; descriptive"
q350;Do you have a really good relationship with both your parents?;Yes;No;;;10152;O;;descriptive
q351;Do you think you have ESP at all?;Yes;No;;;14687;O;;religion/superstition
q352;Would you rather date someone extremely hot or extremely honest?;Extremely hot;Extremely honest;;;20751;O;;preference
q354;Would you be comfortable being poor for the rest of your life?;Yes;No;;;26061;O;;"preference; opinion"
q356;Do you have any credit cards?;Yes;No;;;10543;O;;descriptive
q357;Which makes for a better first date?;Coffee and chit-chat;Drinks and groping;;;26341;N;;"sex/intimacy; preference; opinion"
q358;Do you know the first name of every person you've ever made out with?;Yes;No;;;24303;O;;sex/intimacy
q360;You are more romantic than most people you know.;True;False;;;15045;O;;"sex/intimacy; descriptive"
q365;How much would you enjoy hosting a big, crazy party?;A lot;Not that much;Not at all;;23047;O;;"preference; opinion"
q366;When you're not in a serious relationship, what do you prefer?;Dating multiple people at once;Dating one person at a time;I only have serious relationships, I don't 'date';;25073;O;;preference
q368;If someone wrongs you do you exact revenge?;Yes;No;;;4190;O;;descriptive
q369;Which would you rather drive?;A fast sports car;An SUV;Something more environmentally friendly;;11314;N;;"politics; preference"
q375;Do you like going to the movies alone?;Yes;No;;;18131;O;;preference
q376;Do you enjoy being photographed?;Yes;No;;;9965;O;;preference
q382;Is long hair on a guy inappropriate?;Yes;No;;;25262;O;;opinion
q383;Is it cool for guys to wear earrings?;Sure, it's fine;No way;;;20430;O;;opinion
