;text;option_1;option_2;option_3;option_4;N;Type;Order;Keywords
q18682;Do you think physical love is necessary for happiness in life?;Yes;No;;;26153;O;;opinion
q18688;Do you believe that morality is completely relative?;Yes;No;A little / I'm not sure;;6199;O;2, 3, 1;"religion/superstition; opinion"
q18691;Is it important to be friends before being lovers ?;Yes;No;I'm Not Sure;;17350;O;2, 3, 1;"sex/intimacy; opinion"
q18692;Do you have an ex that you would really like to date again?;Yes;No;;;31366;O;;"sex/intimacy; descriptive"
q18695;Do you feel you have a purpose or calling in life?;Yes;I'm Not Sure;Definitely Not;;2794;O;;"religion/superstition; descriptive"
q18698;A little grade 10 science. Ideal Gas Law?;PV = nRT;G + V = 1/T;y=mx+b;Not sure / wish I could skip this one;1688;N;;cognitive
q18699;Would you ever marry for anything other than love?;Yes;No;;;5723;O;;preference
q18708;Which of the following best describes Science, in your opinion?;A belief system, no better or worse than Religion.;A method one can follow to make predictions.;A post-hoc explanation of God's miracles.;Hello? Like totally boring, dude.;21632;N;;religion/superstition
q18711;Have you ever cosplayed? (Dressed up as a comic/anime character);Yes;No, and I wouldn't be interested;No, but it sounds cool;;21942;O;;"descriptive; preference; opinion"
q18714;Which of these do you use/consult the MOST when making decisions?;Mysticism/Religion/Higher Power;Emotion/Instinct;Logic/Reason;Random Chance;12010;N;;"religion/superstition; preference"
q18721;During sexual activities you notice your partner staring off into space, bored. Do you stop?;Yes;No;;;6640;O;;sex/intimacy
q18729;Are you narcissistic?;Completely!;Quite a bit;A tiny bit;Not at all;7349;O;;descriptive
q18738;It's okay to be arrogant and snobbish if you know you're right.;Yes;No;Sometimes;I don't know;9504;O;2, (3, 4), 1;opinion
q18758;Do you find that arguing with your significant other is arousing to you?;Yes;No;I'm Not Sure;;12999;O;2, 3, 1;"sex/intimacy; descriptive"
q18759;How often do you wear underwear?;Always;Usually;Rarely;Never;10861;O;;descriptive
q18763;Do you consider yourself to be an honorable person?;Yes, I always try to do the right thing.;Sometimes, it depends on the situation.;No, not really.;Are you kidding? I lie, cheat , AND steal.;23284;O;;descriptive
q18775;A person you're interested in attempts to cook a romantic meal for you.  After tasting a bit of it, you notice it hasn't been cooked completely.  What do you do?;Smile and hope your gag reflex doesn't kick in.;Tell him/her the food needs to cook a little longe;Flat out refuse to eat it.;I'm not sure.;3391;O;3, 2, 4, 1;preference
q18776;Would you lie to keep your lover from going to jail?;Yes;No;I'm Not Sure;;8780;O;2, 3, 1;preference
q18778;Which is the smallest amount of money you would stop to pick up if you saw it laying in the street?;Penny;Nickel;Dime;A quarter or more.;8748;O;;preference
q18779;Have you ever been a member of an organization like Girl Scouts, Girl Guides, Boy Scouts, or Campfire?;Yes;No;;;9893;O;;descriptive
q18781;Do you agree with the statement 'everyone's a little racist'?;Yes;No;;;5971;O;;"politics; opinion"
q18782;Hippies?;Them's good people, man.;I don't dig 'em.;I don't care.;;5038;O;2, 3, 1;"politics; preference; opinion"
q18783;It's important that I smell good.;True;False;;;14740;O;;preference
q18789;Would you prefer a daughter or a son?;Daughter;Son;Indifferent;Neither;11350;M;2, 3, 1, [4];preference
q18797;Would you - for any reason - read your mate's email or pose as him/her online, without his/her knowledge and permission?;Yes, they shouldn't be keeping secrets anyway.;Yes, I'd be too curious not to.;Only if I suspected them of something.;No, I'd trust them and that would be invasive.;38006;O;;preference
q18809;How many countries that are part of the European Union can you name?;0-3;4-8;9-14;15 or more;1267;O;;descriptive
q18814;Should a country always need the UN's approval before declaring war?;Yes;No;;;6419;O;;politics
q18820;Is your alarm clock :;Your best friend.;The bane of your existence.;Useful, unless I'm hungover.;Useless, I have an internal clock.;12517;M;2, 3, 1, [4];descriptive
q18821;Are people who believe in the paranormal (IE: Ghosts, Vampires, Aliens, ESP, etc.) all crazy or suffering from some sort of mental disorder/delusion?;Yes, and they all need mental help, now.;Yes, but I couldn't care less.;No, but I personally don't believe;No, I'm a very big believer in the paranormal.;8774;O;;religion/superstition
q18822;Hypothetically, and if the lack of either wouldn't affect your health, which would you give up?;Sex;Sleep;;;8456;N;;"sex/intimacy; preference"
q18825;Does it annoy you when an OkCupid user has no pictures that show their face?;Yes;No;;;22238;O;;"preference; descriptive"
q18832;If you could only keep one sense, what would it be?;Sight;Hearing;Touch;Smell;12678;N;;preference
q18834;If you had to name your greatest motivation in life thus far, what would it be?;Love;Wealth;Expression;Knowledge;46158;N;;descriptive
q18837;Someone is staring at you, and you notice. Do you:;Stare back intensely until he/she looks away?;Look away first, or immediately?;Raise an eyebrow (or two)?;Say something lame? 'Take a picture...';11666;N;;preference
q18840;How was your childhood?;Wonderful!;It was okay.;Not great, but I'm no worse for the wear.;Awful, and I have emotional issues as a result.;19307;O;;descriptive
q18841;Would you date someone that you'd had a one night stand with?;Yes, but only if the sex had been good.;Yes, but only if I liked that person.;No.;;10858;O;(1, 2), 3;"sex/intimacy; preference"
q18843;Are you a good liar?;Yes;No;;;29472;O;;descriptive
q18857;How many concerts do you attend a year?;8+;4-7;1-3;0, typically;19649;O;;descriptive
q18858;Should speech be...;Completely free;Have some censorship;Be very censored;Only say what the dictator wants!;20060;O;;politics
q18861;What do you think of the game of Rugby?;A game for savage barbarians;Cool, but not for me..;Can't get enough of it!;I don't know anything about it/I don't care;12395;O;3, 2, 4, 1;"preference; descriptive"
q18867;You see a yellow light and aren't sure whether or not you can pass it before it turns red. What do you do?;Speed up;Slow down;;;1729;O;;"preference; descriptive"
q18870;Do you believe that mind and body are separate entities (Dualism) or do you believe that they are in a state of unity? (Monism);Monism;Dualism;A bit of both;Uncertain;9681;O;2, (3, 4), 1;"religion/superstition; opinion"
q18875;How important is it to you that your partner smell good?;Very damn important;Important-ish;Less important than you think;I just don't care at all;43478;O;;preference
q18878;Are you able to make a decision and stick to it?;Always;Sometimes;Rarely;Never;4000;O;;descriptive
q18882;You walk out of your home first thing in the morning, late for work and in a serious hurry because you greatly enjoy your job and don't want to lose it. At the same time, a bird with a broken wing is struggling in some bushes nearby. What do you do?;Keep moving - sorry bird, I gotta roll.;Stop and do what you can to help.;Kill it - put it out of its misery.;Keep moving, but feel bad about it.;3894;N;;"descriptive; preference"
q18883;Pretend time! Say someone (who lives far away but somewhere you've wanted to go for a long time) messages you online. Having a great time talking for an hour or so, they offer to fly you there the next day to meet them. What do you do?;Yay! I'm there first thing tomorrow!;Let me think about it and get back to you.;Decline politely.;What the hell? Block list.;6496;O;;"preference; descriptive"
q18889;Do you feel comfortable in an educational or academic environment?;I love it, I'd possibly make teaching a career;Yes, but sixteen to twenty years is enough for me;I can tolerate it, but it's just a means to an end;Get me as far from school as possible. Now!;3655;O;;"preference; descriptive"
q18894;Are you an insomniac?;Yes;No;Occasionally;;18362;O;2, 3, 1;descriptive
q18895;How do you take care of household pests (cockroaches, spiders and the like)?;Squish!;Careful Relocation Outside;I'm Not Sure;Live and Let Live;6881;O;4, 2, 3, 1;"preference; descriptive"
q18900;Do you chew with your mouth open?;Yes;Sometimes;No;;21168;O;;descriptive
q18902;Would you date someone who was only interested in a committed, long-term relationship?;Yes;No;I'm Not Sure;;12736;O;2, 3, 1;preference
q18905;Would you pose nude for a magazine?;Yes;No;I'm Not Sure;;13718;O;2, 3, 1;preference
q18906;Does the idea of time travel appeal to you?;Yes;No;;;12845;O;;preference
q18918;Do you enjoy visiting art galleries?;Yes;No;Art is boring;;18090;O;;preference
q18928;Do you find yourself affected more by movies than by real life?;Yes!;No...;I sure hope not;;4037;O;2, 3, 1;descriptive
q18935;What's the most off-putting or unattractive?;Zits all over the face;Zits all over the back/bum/legs;Major obesity;None of those things matter to me;5431;N;;preference
q18946;What's more important, happiness or safety in relationships?;Being happy;Being safe;;;3091;O;;preference
q18953;Your date for the evening surprises you with a pair of opera tickets.  You;ask whether Domingo or Carreras is singing.;say 'I've never been before, but fun!';go along to avoid hurting your date's feelings.;develop a sudden, severe case of the flu.;8892;O;;preference
q18955;Would you date someone who's smart but achieved nothing in life?;Yes;No;;;24118;O;;preference
q18964;A difficult, somewhat trying relationship where your opinions on many subjects are more often than not divergent, versus an easy relationship where you agree on nearly everything all the time.;Hard - life is defined by difficulty;Easy - why argue with the one you love?;I'm Not Sure;Life isn't that black and white, bub!;5420;M;2, 3, 1, [4];opinion
q18966;Do you prefer hardcore or softcore when it comes to your porn?;Hard!;Soft!;Both!;I don't like porn;24917;M;2, 3, 1, [4];"sex/intimacy; preference"
q18968;Should women be just as likely to be drafted during a major war as men are?;Yes;No;I'm Not Sure;;3230;O;2, 3, 1;politics
q18977;Do you believe in second chances when it comes to romantic relationships?;Yes, it may work out in another time/place.;No, it didn't work the first time, it never will;Depends on the relationship;;10870;O;2, 3, 1;"sex/intimacy; opinion"
q18979;If you found out your partner was cheating on you, would you cheat on them in revenge?;Yes, they have it coming!;No, I'd confront them.;No, I'd dump them on the spot.;Maybe, if one of their friends is cute.;28233;O;3, 2, 4, 1;"sex/intimacy; preference"
q18982;If you asked for time off of work to see your favorite band and it wasn't granted, would you skip work to see the show anyway?;Yes;No;;;2649;O;;preference
q18984;Assuming you've been in a failed relationship, Does your ex-partner's opinion still matter to you?;Yes, a little.;No, never.;Yes, still waiting on a second chance!;;5217;O;3, 1, 2;"preference; descriptive"
q19003;Would you want to be the leader of your country?;Yes.;No, I don't think I'd be best for the job.;No, I wouldn't want that much responsibility.;I'm not sure.;1117;O;(2, 3), 4, 1;"preference; descriptive"
q19011;Do you have a TV in your bedroom?;Yes;No;;;25467;O;;descriptive
q19026;What is more important to humanity:;Establishing a Mars Colony;Uniting all governments into one;Curing most known diseases;Eliminating poverty;8341;N;;politics
q19058;Do you think you basically conform to stereotypes about whatever sex you were born into?;Yes;No;Varies from day to day;I changed/am changing my sex;8722;M;2, 3, 1, [4];descriptive
q19069;Do you think politics have an impact on your everyday life?;Yes;No;I'm Not Sure;Who cares?;2731;M;2, 3, 1, [4];"politics; opinion"
q19075;Would you date someone who doesn't own a car?;Yes;No;;;28928;O;;preference
q19079;What style of online writing annoys you most?;It gt 2 b dis typ: cuz it showz dat dey is fik;ThIs TyPe: It JuSt LoOkS sTuPiD..;ALL CAPITALS: THE STYLE OF THE ATTENTION SEEKER!;Consistent proper English: We are not at school!;14947;N;;preference
q19081;Do you live with your parent(s)?;Yes;No;;;18327;O;;descriptive
q19088;Do you believe there are only two genders?;Yes;No;I'm Not Sure;;11903;O;2, 3, 1;opinion
q19094;Ouija Boards - Cool or Crap?;Very cool!;Crap - a waste of time!;I'm Not Sure.;;2659;O;2, 3, 1;"religion/superstition; preference"
q19100;Have you ever been described as 'fidgety'?;Yes;No;Once or twice;;9561;M;1, 2, [3];descriptive
q19106;Are attractive people generally bad persons?;Yes;No;What?;;6880;O;2, 3, 1;opinion
q19108;Do you think safe sex should be taught in schools?;Yes;No;;;12941;O;;"politics; religion/superstition"
q19110;What do you do with your money?;Spend it all and live paycheck to paycheck.;Save some for an emergency fund, spend the rest.;Save some/most of it, but not invest it.;Save some/most of it and invest it.;3343;O;;descriptive
q19125;Are you concerned with your image and the way others perceive you?;Very Much So;Often, yes;A little bit;Not at all / I hate the mainstream;23440;O;;descriptive
q19140;Personally, is sex in a public place hotter than indoor sex?;Yes;No;I'm Not Sure / Wouldn't know;;23411;O;2, 3, 1;sex/intimacy
q19145;Guys/girls who are tall and lanky:;Love it!;Hate it!;Don't particularly care;;21439;O;2, 3, 1;preference
q19148;Would you consider dating someone who had spent considerable time in a mental health facility? (i.e. mental hospital/institution.);Yes;No;I'm Not Sure;;2899;O;2, 3, 1;preference
q19192;Which of the following is MORE important to you:;Finding someone I love and want to be with;Having children;;;18522;O;;"sex/intimacy; preference"
q19198;Would you ever consider dating an open-minded atheist?;Yes;No;I'm Not Sure;;6118;O;2, 3, 1;"religion/superstition; preference"
q19215;Could you date someone who has (and acts on) radical-left politics?;Yes;No way, you commie;As long as it's non-violent.;Not sure;13145;O;2, 3, 4, 1;"politics; preference"
q19219;Can you change a tire on your own?;Yes;No;;;14042;O;;descriptive
q19221;What is your attitude toward service-industry/hospitality professionals (waitstaff, bellhops, valets, etc.)?;They deserve their tips;They need to get a real job;It's a good way to start your career;They're so beneath me;4485;N;;"politics; opinion"
q19236;Is there a point in a relationship where it can get 'too serious'?;Yes;No;;;10153;O;;"sex/intimacy; preference; opinion"
q19263;If you could kill all the mosqutoes in the world in an instant, would you do it?;Yes!;No;I'm Not Sure;;5911;O;2, 3, 1;preference
q19265;A college-level education is...;Necessary;Nice, but not mandatory;Unnecessary;;39043;O;;preference
q19290;Does violence ever solve anything?;Yes, everything;No, violence solves nothing;Most of the time;Almost never, but sometimes;18023;O;2, 4, 3, 1;"politics; opinion"
q19292;Have you ever taken a break while at work to 'play' with yourself ?;Yes;No;;;10007;O;;descriptive
q19365;If you meet someone and they are everything you are looking for, except their body type, do you give them a chance?;Yes;No;;;25296;O;;preference
q19378;How are you most likely to show your partner you care?;Words: Tell them how much you appreciate them;Actions: Do something nice (like a date or errand);Gifts: Buy them flowers, jewelery or a new gadget;Touch: Give them a hug, massage or kiss;40178;N;;"sex/intimacy; preference; descriptive"
q19392;Have you ever written something on the wall of a public toilet?;Yes;No;;;28999;O;;descriptive
q19418;The idea of being a 'housewife' (ie primary caretaker of house/spouse/possible children):;Is appealing;Is creepy, housewives have no self-respect.;Is something I've never thought about;;1914;O;2, 3, 1;opinion
q19445;Do you feel the urge to correct people who say stupid things?;Yes;No;Sometimes;;18479;O;2, 3, 1;"preference; descriptive"
q19446;Have you ever made a booty call (invited over or visited someone you were not actively in a relationship with, just for sexual activity)?;Yes, and I still do.;Yes, I have done it, but don't any more.;No, and I never will.;No, but I suppose I might.;17693;O;3, 4, 2, 1;"preference; descriptive"
q19449;Have you ever gone white water rafting?;Yes, I love it;No, never;Yes, but never again;No, but I'd like to;15713;O;2, (3, 4), 1;"preference; descriptive"
q19458;Is it ok for a girl to ask a guy out on a date?;Yes, it's perfectly ok;Yes, but it comes across as desperate;No;;21497;O;;opinion
q19470;What do you feel is the hardest part of a romantic relationship?;The first time you meet;Going from friends/dating to 'relationship';Dealing with the person day in day out for years;The end of the relationship (by whichever means);3949;N;;opinion
q19475;Do you believe that intelligence is a big factor in how long it takes a person to get angry or frustrated with something or someone?;People of higher intelligence are quick to anger;People of lower intelligence are quick to anger;Intelligence has nothing to do with it;;1209;O;2, 3, 1;opinion
q19481;On average, how do your friends compare to you, age-wise?;They're mostly older than I;They're mostly younger than I;They're about the same age;I don't have that many friends;12306;M;2, 3, 1, [4];descriptive
q19482;Teasing:;Fantastic, make me a sexual martyr;Good in moderation, only if something comes of it;Not so fun;Horrible, the work of evildoers;13793;O;;sex/intimacy
q19483;When you take a liking to someone you...;Talk to them as often as possible.;Talk to them occasionally.;Wait for them to talk to you.;Avoid them.;6997;O;;preference
q19484;Do you ever want to punch people you don't know, right in the face, for superficial reasons (the way they grin, their clothes, their voice, etc.)?;Every day;It happens, but not often;Never;;14926;O;;"preference; descriptive"
q19508;You're talking to an attractive person in a bar and almost everything they say is in some way connected to television or films. What does that make them?;Major geek. Bye.;Cool - I'm just the same;Doesn't bother me;;4692;O;2, 3, 1;preference
q19566;Would you consider dating a High School dropout?;Yes;Yes, if they are doing well;No;;11773;O;;preference
q19567;How many hours of television do you watch per week?;None;1-7;8-20;My brain is fried;20925;O;;descriptive
q19573;Do you value humility?;Yes;No;;;14874;O;;"preference; descriptive"
q19574;Could you date someone that has put off a relationship with someone else, with the intent of picking it up again later?;Yes;No;;;2513;O;;preference
q19625;Do you write creatively (novels, plays, poetry, and so forth)?;Call me Shakespeare;Yes, only for assignments, though;Not really / no;;13088;O;;descriptive
q19649;Do you find body hair attractive?;Yes;No;Depends on where the hair is;;14617;O;2, 3, 1;preference
q19652;How long does it take you to get ready in the morning?;I'm ready when I wake up;Less than 1 hour;1 - 2 hours;2 hours or more;20317;O;;descriptive
q19664;If your 9 year old daughter was begging you to allow her to wear a thong, what would your response be?;Sure, why not?;Hell no.;I would consider it.;;10337;O;2, 3, 1;descriptive
q19681;Are some sex acts with consenting adults inherently wrong or immoral?  Assume no unusual risk of injury.;Yes;No;;;27949;O;;"sex/intimacy; religion/superstition"
q19690;Would you date someone who used to have a problem with cutting themselves and have scars to prove it?;Yes;No;I'm Not Sure;;11312;O;2, 3, 1;preference
q19691;How would you say your self esteem is?;High;Low;Neither high nor low;;19235;O;2, 3, 1;descriptive
q19692;Are you grossed out by acne ?;Totally;I can tolerate it in moderate amounts;Not at all;;15619;O;;"preference; descriptive"
q19695;In general, are you a competitive person?;Very often;Sometimes / rarely;Never / not really;;21949;O;;descriptive
q19737;Could you live a life full of traveling?;Yes;No;;;24187;O;;descriptive
q19748;What's your opinion of male crossdressers?;I have no problem with them. You go girls!;I respect them, but they still freak me out.;Whatever they do in private is their business.;I do not approve of them.;18786;O;4, (2, 3), 1;"politics; opinion"
q19772;Which of the two would be your preference: A lifetime supply of your favorite snack food or a 30-minute orgasm??;Duh. The 30-minute orgasm;Give me the Snacks!;;;12761;N;;"sex/intimacy; preference"
q19776;At what age is it appropriate to talk to your children about non-traditional relationships (e.g., homosexuality)?;Before 10;After 10, before 17;18 or later;Never;6628;O;;"politics; religion/superstition; opinion"
q19784;When you draw a picture, write a poem, or otherwise do something creative, are you shy about letting other people see it?;Sometimes;Rarely;Often;If I'm still learning the required skills;10813;M;3, 1, 2, [4];descriptive
q19799;Do you believe dreams have hidden meanings to them?;Yes;No;;;3926;O;;"religion/superstition; opinion"
q19800;Would you pretend to share an interest with someone you really liked as a way to gain favour with them?;Yes;No;;;2361;O;;"preference; descriptive"
q19813;Is it better to live by your own moral standards and allow others to live by theirs, or is it better to press your moral standards upon other people?;Live and let live;Press those morals!;;;15420;O;;"politics; religion/superstition; opinion"
q19815;Your significant other is perfectly content with their minimum wage job and has no plans to look for more challenging/better paying work. Is this a problem?;Yes, I wouldn't be able to tolerate that.;Somewhat, but it's their life.;No, I don't mind.;;31022;O;;preference
q19820;Would you date someone with braces?;Yes, braces are hot!;I'm not sure.;No way!  How uncool.;;10643;O;;preference
q19828;Would you open your spouse's personal mail?;We're a couple, who cares?;No, that's theirs to open.;;;9314;O;;preference
q19832;Would you consider attending the wedding of a relative you haven't seen since childhood?;Yes, no matter what.;No, they're not a part of my life anymore.;Depends on the circumstances. Distance, time, etc;;12051;O;2, 3, 1;preference
q19854;Are sex and intimacy the same thing?;Yes;No;;;29800;O;;"sex/intimacy; opinion"
q19869;An ex wants you to come over and hang out: a situation that is likely to lead to hooking back up with him or her.  Do you:;Go over: it's not like you haven't before;Go, making sure things stay at 'friends only';Don't go: can't risk it;Suggest you both go out with a group;2882;M;[4];preference
q19874;How long do your romantic relationships usually last?;0-6 months;6-12 months;12+ months;I've never been in a relationship;40948;M;[4];descriptive
q19885;Someone offers to give you $100 if you *don't* vote in the next national election. (for example, the US President)  Do you take the money?;Yes;No;;;7489;O;;"politics; preference"
q19886;On the job, which of these is most important to you:;A sense of calling, vocation, or higher purpose;a reliable network of friends and coworkers;security, an ordered existence;stickin' it to the Man;2613;N;;preference
q19891;If you found out that your significant other had been in pornographic films, which of the following most closely describes your reaction?;Repulsion;Arousal;Indifference;;9119;O;2, 3, 1;preference
q19892;Foot fetish?;Yes, I have a foot fetish!;No, I don't have a foot fetish;;;20831;O;;sex/intimacy
q19893;Is a tongue stud a turn-on?;Yes;No;;;23472;O;;"sex/intimacy; preference"
q19897;Do you play or have you ever played a Massive Multiplayer Online Role Playing Game?;I enjoy playing them;I'm a recovering addict - never again;No, but I'd like to try one;Not my type of thing / NO IDEA;20832;O;;"preference; descriptive"
q19898;Do you enjoy finding out what makes things work the way they do?;I'm an information sponge;Sometimes;As long as it works, who cares why?;;41310;O;;"preference; descriptive"
q19915;Could you date someone with a significant Taoist lean in their outlook on life?;Yes, I love the Tao Te Ching.;Sure, why not?;No, they'd be too laid back.;What the hell is Taoism?;19210;O;3, 4, 2, 1;"religion/superstition; preference"
q19919;Would you prefer to have one true love forever, or lots of fun and meaningful relationships?;One true love;Lots of relationships;;;24947;O;;"sex/intimacy; preference"
q19928;Honestly, did you ever torture a cat, dog, or any other furry animal for pleasure?;Yes, but I regret it.;NO WAY!;Yeah, that's fun.;No, but I would do it.;10725;O;2, (1, 4), 3;"preference; descriptive"
q19931;Straight women who kiss or fondle each other in clubs in the hopes of attracting men are...;Incredibly hot!;Just having some girlish fun.;Profoundly annoying.;;38427;O;;"preference; opinion"
q19941;You're in a serious, monogamous relationship when your partner gets offered their dream job overseas for three years.  They have decided that it's a chance they just can't pass up.  Which of these choices is most appealing to you?;Trying to arrange it so you can go with;Maintaining a long-distance relationship;Staying friends, but dating around til they return;Breaking up and moving on;7683;O;;preference
q19996;You have a major crush on a good friend's significant other. This friend is having trouble in the relationship and asks you for advice, do you:;Give your friend honest advice?;Seize the opportunity, suggesting a breakup?;Find a way around giving them any advice?;;3224;N;;"sex/intimacy; preference"
q20016;Protesting for civil rights issues is...;... just for pretentious snobs who want attention.;... necessary, but it's just not for me.;... somewhat important, but not for all issues.;... something that I actively participate in.;7487;O;;"politics; opinion"
q20021;Which of these options most closely describes what you're looking for in your next relationship?;Someone to come home to;Someone to go out with;Someone for tonight;;40763;N;;preference
